{
  "metadata": {
    "generated": "2025-11-25T19:42:53.900Z",
    "purpose": "Checkpoint 13 Multi-Tenant Verification",
    "totalTranscripts": 44,
    "clientCount": 11,
    "uniqueMarkers": [
      {
        "client": "Sarah Williams",
        "marker": "SARAH_ACME_UNIQUE_MARKER_7X9K",
        "coach": "Alex Rivera"
      },
      {
        "client": "Emily Zhang",
        "marker": "EMILY_TECHCORP_UNIQUE_MARKER_3M2P",
        "coach": "Alex Rivera"
      },
      {
        "client": "Priya Sharma",
        "marker": "PRIYA_GROWTHLABS_UNIQUE_MARKER_8T4V",
        "coach": "Alex Rivera"
      },
      {
        "client": "Marcus Johnson",
        "marker": "MARCUS_SCALEUP_UNIQUE_MARKER_2R6Y",
        "coach": "Alex Rivera"
      },
      {
        "client": "David Kim",
        "marker": "DAVID_TECHCORP_UNIQUE_MARKER_5N1Q",
        "coach": "Jordan Taylor"
      },
      {
        "client": "Lisa Park",
        "marker": "LISA_GROWTHLABS_UNIQUE_MARKER_9W3Z",
        "coach": "Jordan Taylor"
      },
      {
        "client": "James Wilson",
        "marker": "JAMES_INNOVATE_UNIQUE_MARKER_4H8B",
        "coach": "Jordan Taylor"
      },
      {
        "client": "Michael Torres",
        "marker": "MICHAEL_ACME_UNIQUE_MARKER_6L2D",
        "coach": "Sam Chen"
      },
      {
        "client": "Amanda Foster",
        "marker": "AMANDA_SCALEUP_UNIQUE_MARKER_1F7J",
        "coach": "Sam Chen"
      },
      {
        "client": "Kevin Chen",
        "marker": "KEVIN_INNOVATE_UNIQUE_MARKER_0G5K",
        "coach": "Sam Chen"
      },
      {
        "client": "Rachel Adams",
        "marker": "RACHEL_GROWTHLABS_UNIQUE_MARKER_3C9M",
        "coach": "Sam Chen"
      }
    ]
  },
  "transcripts": [
    {
      "clientId": "550e8400-e29b-41d4-a716-446655440001",
      "clientName": "Sarah Williams",
      "coachId": "550e8400-e29b-41d4-a716-446655440010",
      "coachName": "Alex Rivera",
      "org": "Acme Media",
      "sessionDate": "2025-07-31T12:51:50.138Z",
      "sessionType": "quarterly-review",
      "content": "Coaching Session: Quarterly Review\nClient: Sarah Williams, VP of Product at Acme Media\nCoach: Alex Rivera\nDate: 2025-07-31\nSession Marker: SARAH_ACME_UNIQUE_MARKER_7X9K\n\nAlex Rivera: Welcome back, Sarah. I've been looking forward to our quarterly review. How are you feeling about the progress we've made?\n\nSarah: Thank you, Alex. It's been an intense quarter. Project Nexus - Q1 product roadmap overhaul has consumed most of my bandwidth, but I feel like we're making real progress.\n\nAlex Rivera: Tell me more about Project Nexus - Q1 product roadmap overhaul. What's working well?\n\nSarah: The team is finally aligned. We had some resistance initially, especially around product strategy, but after our last session where you helped me reframe the narrative, things clicked.\n\nAlex Rivera: I'm glad that product strategy framework is paying off. What challenges remain?\n\nSarah: Honestly, the biggest challenge is team scaling. As we scale, I'm finding it harder to maintain the quality of interactions with my team.\n\nAlex Rivera: Let's dig into that. When you say team scaling, what specifically concerns you?\n\nSarah: I used to have weekly 1:1s with everyone. Now with the growth, it's impossible. I'm worried about losing touch with the pulse of the organization.\n\nAlex Rivera: This is a common inflection point for leaders at your stage. Let me share a model that's helped other executives I've worked with...\n\n[Session continues with detailed discussion of leadership scaling strategies, action items, and next steps related to product strategy, team scaling, executive presence]\n\nAction Items:\n1. Implement skip-level meetings every two weeks\n2. Create a \"listening tour\" schedule for Q2\n3. Document Project Nexus - Q1 product roadmap overhaul milestones for board presentation\n4. Practice executive presence exercises before next town hall\n\nNext session: Focus on executive presence development",
      "uniqueMarker": "SARAH_ACME_UNIQUE_MARKER_7X9K",
      "secretProject": "Project Nexus - Q1 product roadmap overhaul",
      "themes": [
        "product strategy",
        "team scaling",
        "executive presence"
      ]
    },
    {
      "clientId": "550e8400-e29b-41d4-a716-446655440001",
      "clientName": "Sarah Williams",
      "coachId": "550e8400-e29b-41d4-a716-446655440010",
      "coachName": "Alex Rivera",
      "org": "Acme Media",
      "sessionDate": "2025-10-20T12:58:14.836Z",
      "sessionType": "challenge-session",
      "content": "Coaching Session: Challenge Deep-Dive\nClient: Sarah Williams, VP of Product at Acme Media\nCoach: Alex Rivera\nDate: 2025-10-20\nUnique Identifier: SARAH_ACME_UNIQUE_MARKER_7X9K\n\nAlex Rivera: Sarah, you mentioned in your pre-session notes that you're facing a significant challenge with product strategy. Walk me through what's happening.\n\nSarah: Alex, I'm at a crossroads. Project Nexus - Q1 product roadmap overhaul has hit a major roadblock. The board is asking tough questions, and I'm not sure I have the answers.\n\nAlex Rivera: Let's break this down. What exactly is the board concerned about?\n\nSarah: They want to see faster progress on team scaling. Our metrics aren't where we projected them to be.\n\nAlex Rivera: When you think about team scaling in the context of Acme Media's current stage, what does success actually look like?\n\nSarah: That's a good question. I think I've been measuring myself against industry benchmarks that don't apply to our unique situation.\n\nAlex Rivera: Exactly. Let's redefine success metrics that align with Acme Media's specific context. What would you say are the three most critical indicators?\n\nSarah: For Project Nexus - Q1 product roadmap overhaul specifically, I'd say: customer retention, team velocity, and stakeholder confidence.\n\nAlex Rivera: Now we're getting somewhere. How do these connect to your work on executive presence?\n\nSarah: executive presence is the thread that ties it all together. If I can improve that, everything else follows.\n\nAlex Rivera: What's one action you could take this week that would move the needle on executive presence?\n\nSarah: I've been avoiding a difficult conversation with my leadership team about expectations. That needs to happen.\n\nAlex Rivera: Tell me about your hesitation around that conversation.\n\n[Detailed exploration of communication patterns, stakeholder management, and executive presence development]\n\nKey Insights:\n- Sarah Williams recognizes the need for clearer metrics alignment\n- Project Nexus - Q1 product roadmap overhaul requires reframing for stakeholder buy-in\n- executive presence is the critical development area for next quarter\n\nFollow-up: Schedule role-play session for difficult conversation practice",
      "uniqueMarker": "SARAH_ACME_UNIQUE_MARKER_7X9K",
      "secretProject": "Project Nexus - Q1 product roadmap overhaul",
      "themes": [
        "product strategy",
        "team scaling",
        "executive presence"
      ]
    },
    {
      "clientId": "550e8400-e29b-41d4-a716-446655440001",
      "clientName": "Sarah Williams",
      "coachId": "550e8400-e29b-41d4-a716-446655440010",
      "coachName": "Alex Rivera",
      "org": "Acme Media",
      "sessionDate": "2025-10-27T16:45:05.157Z",
      "sessionType": "goal-setting",
      "content": "Coaching Session: Goal Alignment & Planning\nClient: Sarah Williams, VP of Product at Acme Media\nCoach: Alex Rivera\nDate: 2025-10-27\nSession ID: SARAH_ACME_UNIQUE_MARKER_7X9K\n\nAlex Rivera: Sarah, as we enter this new planning cycle, I want to make sure our coaching goals are aligned with what matters most to you professionally and personally.\n\nSarah: Alex, that's perfect timing. Acme Media is going through major changes, and I need to recalibrate.\n\nAlex Rivera: What's driving that need for recalibration?\n\nSarah: Project Nexus - Q1 product roadmap overhaul is entering its critical phase. My role is expanding, and I need to develop new capabilities, particularly in product strategy.\n\nAlex Rivera: Let's map out what product strategy looks like at the next level. Where do you feel most confident, and where do you see gaps?\n\nSarah: I'm confident in the tactical execution. Where I need growth is in team scaling - specifically, how to influence without direct authority.\n\nAlex Rivera: That's a sophisticated leadership challenge. At Acme Media, who are the key stakeholders you need to influence?\n\nSarah: The executive team, board members, and increasingly, external partners. It's a different game than what got me here.\n\nAlex Rivera: You're right - what got you here won't get you there. Let's design a development plan that addresses team scaling and executive presence.\n\nSarah: I appreciate that you understand the nuances of my situation. The complexity at Acme Media isn't always obvious to outsiders.\n\nAlex Rivera: That's why our work together goes beyond generic leadership advice. We're crafting a path that's specific to Sarah Williams's journey at Acme Media.\n\n[Goal-setting framework discussion with SMART goals, accountability structures, and milestone planning]\n\nGoals Established:\n1. Master product strategy fundamentals by end of Q1\n2. Build team scaling influence map and engagement strategy\n3. Develop executive presence through deliberate practice\n4. Project Nexus - Q1 product roadmap overhaul - achieve key milestone by month-end\n\nSupport Needed:\n- Weekly check-ins during critical Project Nexus - Q1 product roadmap overhaul phases\n- Access to peer coaching cohort for product strategy practitioners\n- Book recommendations on team scaling",
      "uniqueMarker": "SARAH_ACME_UNIQUE_MARKER_7X9K",
      "secretProject": "Project Nexus - Q1 product roadmap overhaul",
      "themes": [
        "product strategy",
        "team scaling",
        "executive presence"
      ]
    },
    {
      "clientId": "550e8400-e29b-41d4-a716-446655440001",
      "clientName": "Sarah Williams",
      "coachId": "550e8400-e29b-41d4-a716-446655440010",
      "coachName": "Alex Rivera",
      "org": "Acme Media",
      "sessionDate": "2025-11-11T17:39:06.465Z",
      "sessionType": "breakthrough",
      "content": "Coaching Session: Breakthrough Moment\nClient: Sarah Williams, VP of Product at Acme Media\nCoach: Alex Rivera\nDate: 2025-11-11\nReference: SARAH_ACME_UNIQUE_MARKER_7X9K\n\nAlex Rivera: Sarah! I can tell from your energy that something significant has happened. What's going on?\n\nSarah: Alex, I had a breakthrough! Everything we've been working on around product strategy finally clicked in yesterday's board meeting.\n\nAlex Rivera: Tell me everything. What made the difference?\n\nSarah: Remember how we practiced reframing Project Nexus - Q1 product roadmap overhaul as a strategic opportunity rather than a challenge? I used that exact framework.\n\nAlex Rivera: How did the board respond?\n\nSarah: They were engaged in a way I haven't seen before. For the first time, they asked follow-up questions that showed they actually understood the vision.\n\nAlex Rivera: That's the power of executive presence - when you communicate with confidence and clarity, people lean in. What else contributed to this success?\n\nSarah: The preparation work we did on team scaling. I anticipated their concerns and addressed them proactively.\n\nAlex Rivera: You've integrated multiple aspects of our work - product strategy, team scaling, executive presence. This is what mastery looks like.\n\nSarah: I feel like I've leveled up. The imposter syndrome that used to plague me before these meetings is significantly diminished.\n\nAlex Rivera: Let's anchor this win. What specific behaviors will you continue that led to this breakthrough?\n\nSarah: Pre-meeting preparation with stakeholder mapping, practicing my key messages out loud, and arriving with an abundance mindset rather than defensiveness.\n\nAlex Rivera: Those are powerful practices. How can you apply them to Project Nexus - Q1 product roadmap overhaul's next phase?\n\n[Discussion of applying breakthrough lessons to upcoming challenges]\n\nCelebration:\n- Board meeting success demonstrates growth in product strategy and team scaling and executive presence\n- Sarah Williams has internalized coaching frameworks\n- Ready for increased challenge level in future sessions\n\nNext Steps:\n- Document the breakthrough process for future reference\n- Apply same preparation framework to Project Nexus - Q1 product roadmap overhaul stakeholder presentations\n- Schedule debrief after next major Acme Media milestone",
      "uniqueMarker": "SARAH_ACME_UNIQUE_MARKER_7X9K",
      "secretProject": "Project Nexus - Q1 product roadmap overhaul",
      "themes": [
        "product strategy",
        "team scaling",
        "executive presence"
      ]
    },
    {
      "clientId": "550e8400-e29b-41d4-a716-446655440003",
      "clientName": "Emily Zhang",
      "coachId": "550e8400-e29b-41d4-a716-446655440010",
      "coachName": "Alex Rivera",
      "org": "TechCorp Inc",
      "sessionDate": "2025-06-20T05:48:42.592Z",
      "sessionType": "quarterly-review",
      "content": "Coaching Session: Quarterly Review\nClient: Emily Zhang, CEO at TechCorp Inc\nCoach: Alex Rivera\nDate: 2025-06-20\nSession Marker: EMILY_TECHCORP_UNIQUE_MARKER_3M2P\n\nAlex Rivera: Welcome back, Emily. I've been looking forward to our quarterly review. How are you feeling about the progress we've made?\n\nEmily: Thank you, Alex. It's been an intense quarter. Series B preparation - $50M target has consumed most of my bandwidth, but I feel like we're making real progress.\n\nAlex Rivera: Tell me more about Series B preparation - $50M target. What's working well?\n\nEmily: The team is finally aligned. We had some resistance initially, especially around fundraising, but after our last session where you helped me reframe the narrative, things clicked.\n\nAlex Rivera: I'm glad that fundraising framework is paying off. What challenges remain?\n\nEmily: Honestly, the biggest challenge is board management. As we scale, I'm finding it harder to maintain the quality of interactions with my team.\n\nAlex Rivera: Let's dig into that. When you say board management, what specifically concerns you?\n\nEmily: I used to have weekly 1:1s with everyone. Now with the growth, it's impossible. I'm worried about losing touch with the pulse of the organization.\n\nAlex Rivera: This is a common inflection point for leaders at your stage. Let me share a model that's helped other executives I've worked with...\n\n[Session continues with detailed discussion of leadership scaling strategies, action items, and next steps related to fundraising, board management, strategic vision]\n\nAction Items:\n1. Implement skip-level meetings every two weeks\n2. Create a \"listening tour\" schedule for Q2\n3. Document Series B preparation - $50M target milestones for board presentation\n4. Practice strategic vision exercises before next town hall\n\nNext session: Focus on strategic vision development",
      "uniqueMarker": "EMILY_TECHCORP_UNIQUE_MARKER_3M2P",
      "secretProject": "Series B preparation - $50M target",
      "themes": [
        "fundraising",
        "board management",
        "strategic vision"
      ]
    },
    {
      "clientId": "550e8400-e29b-41d4-a716-446655440003",
      "clientName": "Emily Zhang",
      "coachId": "550e8400-e29b-41d4-a716-446655440010",
      "coachName": "Alex Rivera",
      "org": "TechCorp Inc",
      "sessionDate": "2025-07-19T07:54:38.850Z",
      "sessionType": "challenge-session",
      "content": "Coaching Session: Challenge Deep-Dive\nClient: Emily Zhang, CEO at TechCorp Inc\nCoach: Alex Rivera\nDate: 2025-07-19\nUnique Identifier: EMILY_TECHCORP_UNIQUE_MARKER_3M2P\n\nAlex Rivera: Emily, you mentioned in your pre-session notes that you're facing a significant challenge with fundraising. Walk me through what's happening.\n\nEmily: Alex, I'm at a crossroads. Series B preparation - $50M target has hit a major roadblock. The board is asking tough questions, and I'm not sure I have the answers.\n\nAlex Rivera: Let's break this down. What exactly is the board concerned about?\n\nEmily: They want to see faster progress on board management. Our metrics aren't where we projected them to be.\n\nAlex Rivera: When you think about board management in the context of TechCorp Inc's current stage, what does success actually look like?\n\nEmily: That's a good question. I think I've been measuring myself against industry benchmarks that don't apply to our unique situation.\n\nAlex Rivera: Exactly. Let's redefine success metrics that align with TechCorp Inc's specific context. What would you say are the three most critical indicators?\n\nEmily: For Series B preparation - $50M target specifically, I'd say: customer retention, team velocity, and stakeholder confidence.\n\nAlex Rivera: Now we're getting somewhere. How do these connect to your work on strategic vision?\n\nEmily: strategic vision is the thread that ties it all together. If I can improve that, everything else follows.\n\nAlex Rivera: What's one action you could take this week that would move the needle on strategic vision?\n\nEmily: I've been avoiding a difficult conversation with my leadership team about expectations. That needs to happen.\n\nAlex Rivera: Tell me about your hesitation around that conversation.\n\n[Detailed exploration of communication patterns, stakeholder management, and executive presence development]\n\nKey Insights:\n- Emily Zhang recognizes the need for clearer metrics alignment\n- Series B preparation - $50M target requires reframing for stakeholder buy-in\n- strategic vision is the critical development area for next quarter\n\nFollow-up: Schedule role-play session for difficult conversation practice",
      "uniqueMarker": "EMILY_TECHCORP_UNIQUE_MARKER_3M2P",
      "secretProject": "Series B preparation - $50M target",
      "themes": [
        "fundraising",
        "board management",
        "strategic vision"
      ]
    },
    {
      "clientId": "550e8400-e29b-41d4-a716-446655440003",
      "clientName": "Emily Zhang",
      "coachId": "550e8400-e29b-41d4-a716-446655440010",
      "coachName": "Alex Rivera",
      "org": "TechCorp Inc",
      "sessionDate": "2025-10-25T11:08:05.464Z",
      "sessionType": "goal-setting",
      "content": "Coaching Session: Goal Alignment & Planning\nClient: Emily Zhang, CEO at TechCorp Inc\nCoach: Alex Rivera\nDate: 2025-10-25\nSession ID: EMILY_TECHCORP_UNIQUE_MARKER_3M2P\n\nAlex Rivera: Emily, as we enter this new planning cycle, I want to make sure our coaching goals are aligned with what matters most to you professionally and personally.\n\nEmily: Alex, that's perfect timing. TechCorp Inc is going through major changes, and I need to recalibrate.\n\nAlex Rivera: What's driving that need for recalibration?\n\nEmily: Series B preparation - $50M target is entering its critical phase. My role is expanding, and I need to develop new capabilities, particularly in fundraising.\n\nAlex Rivera: Let's map out what fundraising looks like at the next level. Where do you feel most confident, and where do you see gaps?\n\nEmily: I'm confident in the tactical execution. Where I need growth is in board management - specifically, how to influence without direct authority.\n\nAlex Rivera: That's a sophisticated leadership challenge. At TechCorp Inc, who are the key stakeholders you need to influence?\n\nEmily: The executive team, board members, and increasingly, external partners. It's a different game than what got me here.\n\nAlex Rivera: You're right - what got you here won't get you there. Let's design a development plan that addresses board management and strategic vision.\n\nEmily: I appreciate that you understand the nuances of my situation. The complexity at TechCorp Inc isn't always obvious to outsiders.\n\nAlex Rivera: That's why our work together goes beyond generic leadership advice. We're crafting a path that's specific to Emily Zhang's journey at TechCorp Inc.\n\n[Goal-setting framework discussion with SMART goals, accountability structures, and milestone planning]\n\nGoals Established:\n1. Master fundraising fundamentals by end of Q1\n2. Build board management influence map and engagement strategy\n3. Develop strategic vision through deliberate practice\n4. Series B preparation - $50M target - achieve key milestone by month-end\n\nSupport Needed:\n- Weekly check-ins during critical Series B preparation - $50M target phases\n- Access to peer coaching cohort for fundraising practitioners\n- Book recommendations on board management",
      "uniqueMarker": "EMILY_TECHCORP_UNIQUE_MARKER_3M2P",
      "secretProject": "Series B preparation - $50M target",
      "themes": [
        "fundraising",
        "board management",
        "strategic vision"
      ]
    },
    {
      "clientId": "550e8400-e29b-41d4-a716-446655440003",
      "clientName": "Emily Zhang",
      "coachId": "550e8400-e29b-41d4-a716-446655440010",
      "coachName": "Alex Rivera",
      "org": "TechCorp Inc",
      "sessionDate": "2025-10-31T12:12:30.372Z",
      "sessionType": "breakthrough",
      "content": "Coaching Session: Breakthrough Moment\nClient: Emily Zhang, CEO at TechCorp Inc\nCoach: Alex Rivera\nDate: 2025-10-31\nReference: EMILY_TECHCORP_UNIQUE_MARKER_3M2P\n\nAlex Rivera: Emily! I can tell from your energy that something significant has happened. What's going on?\n\nEmily: Alex, I had a breakthrough! Everything we've been working on around fundraising finally clicked in yesterday's board meeting.\n\nAlex Rivera: Tell me everything. What made the difference?\n\nEmily: Remember how we practiced reframing Series B preparation - $50M target as a strategic opportunity rather than a challenge? I used that exact framework.\n\nAlex Rivera: How did the board respond?\n\nEmily: They were engaged in a way I haven't seen before. For the first time, they asked follow-up questions that showed they actually understood the vision.\n\nAlex Rivera: That's the power of strategic vision - when you communicate with confidence and clarity, people lean in. What else contributed to this success?\n\nEmily: The preparation work we did on board management. I anticipated their concerns and addressed them proactively.\n\nAlex Rivera: You've integrated multiple aspects of our work - fundraising, board management, strategic vision. This is what mastery looks like.\n\nEmily: I feel like I've leveled up. The imposter syndrome that used to plague me before these meetings is significantly diminished.\n\nAlex Rivera: Let's anchor this win. What specific behaviors will you continue that led to this breakthrough?\n\nEmily: Pre-meeting preparation with stakeholder mapping, practicing my key messages out loud, and arriving with an abundance mindset rather than defensiveness.\n\nAlex Rivera: Those are powerful practices. How can you apply them to Series B preparation - $50M target's next phase?\n\n[Discussion of applying breakthrough lessons to upcoming challenges]\n\nCelebration:\n- Board meeting success demonstrates growth in fundraising and board management and strategic vision\n- Emily Zhang has internalized coaching frameworks\n- Ready for increased challenge level in future sessions\n\nNext Steps:\n- Document the breakthrough process for future reference\n- Apply same preparation framework to Series B preparation - $50M target stakeholder presentations\n- Schedule debrief after next major TechCorp Inc milestone",
      "uniqueMarker": "EMILY_TECHCORP_UNIQUE_MARKER_3M2P",
      "secretProject": "Series B preparation - $50M target",
      "themes": [
        "fundraising",
        "board management",
        "strategic vision"
      ]
    },
    {
      "clientId": "550e8400-e29b-41d4-a716-446655440005",
      "clientName": "Priya Sharma",
      "coachId": "550e8400-e29b-41d4-a716-446655440010",
      "coachName": "Alex Rivera",
      "org": "GrowthLabs",
      "sessionDate": "2025-06-26T21:03:58.036Z",
      "sessionType": "quarterly-review",
      "content": "Coaching Session: Quarterly Review\nClient: Priya Sharma, Co-founder & CTO at GrowthLabs\nCoach: Alex Rivera\nDate: 2025-06-26\nSession Marker: PRIYA_GROWTHLABS_UNIQUE_MARKER_8T4V\n\nAlex Rivera: Welcome back, Priya. I've been looking forward to our quarterly review. How are you feeling about the progress we've made?\n\nPriya: Thank you, Alex. It's been an intense quarter. Platform migration to Kubernetes has consumed most of my bandwidth, but I feel like we're making real progress.\n\nAlex Rivera: Tell me more about Platform migration to Kubernetes. What's working well?\n\nPriya: The team is finally aligned. We had some resistance initially, especially around technical leadership, but after our last session where you helped me reframe the narrative, things clicked.\n\nAlex Rivera: I'm glad that technical leadership framework is paying off. What challenges remain?\n\nPriya: Honestly, the biggest challenge is engineering culture. As we scale, I'm finding it harder to maintain the quality of interactions with my team.\n\nAlex Rivera: Let's dig into that. When you say engineering culture, what specifically concerns you?\n\nPriya: I used to have weekly 1:1s with everyone. Now with the growth, it's impossible. I'm worried about losing touch with the pulse of the organization.\n\nAlex Rivera: This is a common inflection point for leaders at your stage. Let me share a model that's helped other executives I've worked with...\n\n[Session continues with detailed discussion of leadership scaling strategies, action items, and next steps related to technical leadership, engineering culture, co-founder dynamics]\n\nAction Items:\n1. Implement skip-level meetings every two weeks\n2. Create a \"listening tour\" schedule for Q2\n3. Document Platform migration to Kubernetes milestones for board presentation\n4. Practice co-founder dynamics exercises before next town hall\n\nNext session: Focus on co-founder dynamics development",
      "uniqueMarker": "PRIYA_GROWTHLABS_UNIQUE_MARKER_8T4V",
      "secretProject": "Platform migration to Kubernetes",
      "themes": [
        "technical leadership",
        "engineering culture",
        "co-founder dynamics"
      ]
    },
    {
      "clientId": "550e8400-e29b-41d4-a716-446655440005",
      "clientName": "Priya Sharma",
      "coachId": "550e8400-e29b-41d4-a716-446655440010",
      "coachName": "Alex Rivera",
      "org": "GrowthLabs",
      "sessionDate": "2025-08-29T22:21:25.589Z",
      "sessionType": "challenge-session",
      "content": "Coaching Session: Challenge Deep-Dive\nClient: Priya Sharma, Co-founder & CTO at GrowthLabs\nCoach: Alex Rivera\nDate: 2025-08-29\nUnique Identifier: PRIYA_GROWTHLABS_UNIQUE_MARKER_8T4V\n\nAlex Rivera: Priya, you mentioned in your pre-session notes that you're facing a significant challenge with technical leadership. Walk me through what's happening.\n\nPriya: Alex, I'm at a crossroads. Platform migration to Kubernetes has hit a major roadblock. The board is asking tough questions, and I'm not sure I have the answers.\n\nAlex Rivera: Let's break this down. What exactly is the board concerned about?\n\nPriya: They want to see faster progress on engineering culture. Our metrics aren't where we projected them to be.\n\nAlex Rivera: When you think about engineering culture in the context of GrowthLabs's current stage, what does success actually look like?\n\nPriya: That's a good question. I think I've been measuring myself against industry benchmarks that don't apply to our unique situation.\n\nAlex Rivera: Exactly. Let's redefine success metrics that align with GrowthLabs's specific context. What would you say are the three most critical indicators?\n\nPriya: For Platform migration to Kubernetes specifically, I'd say: customer retention, team velocity, and stakeholder confidence.\n\nAlex Rivera: Now we're getting somewhere. How do these connect to your work on co-founder dynamics?\n\nPriya: co-founder dynamics is the thread that ties it all together. If I can improve that, everything else follows.\n\nAlex Rivera: What's one action you could take this week that would move the needle on co-founder dynamics?\n\nPriya: I've been avoiding a difficult conversation with my leadership team about expectations. That needs to happen.\n\nAlex Rivera: Tell me about your hesitation around that conversation.\n\n[Detailed exploration of communication patterns, stakeholder management, and executive presence development]\n\nKey Insights:\n- Priya Sharma recognizes the need for clearer metrics alignment\n- Platform migration to Kubernetes requires reframing for stakeholder buy-in\n- co-founder dynamics is the critical development area for next quarter\n\nFollow-up: Schedule role-play session for difficult conversation practice",
      "uniqueMarker": "PRIYA_GROWTHLABS_UNIQUE_MARKER_8T4V",
      "secretProject": "Platform migration to Kubernetes",
      "themes": [
        "technical leadership",
        "engineering culture",
        "co-founder dynamics"
      ]
    },
    {
      "clientId": "550e8400-e29b-41d4-a716-446655440005",
      "clientName": "Priya Sharma",
      "coachId": "550e8400-e29b-41d4-a716-446655440010",
      "coachName": "Alex Rivera",
      "org": "GrowthLabs",
      "sessionDate": "2025-09-15T23:28:19.982Z",
      "sessionType": "goal-setting",
      "content": "Coaching Session: Goal Alignment & Planning\nClient: Priya Sharma, Co-founder & CTO at GrowthLabs\nCoach: Alex Rivera\nDate: 2025-09-15\nSession ID: PRIYA_GROWTHLABS_UNIQUE_MARKER_8T4V\n\nAlex Rivera: Priya, as we enter this new planning cycle, I want to make sure our coaching goals are aligned with what matters most to you professionally and personally.\n\nPriya: Alex, that's perfect timing. GrowthLabs is going through major changes, and I need to recalibrate.\n\nAlex Rivera: What's driving that need for recalibration?\n\nPriya: Platform migration to Kubernetes is entering its critical phase. My role is expanding, and I need to develop new capabilities, particularly in technical leadership.\n\nAlex Rivera: Let's map out what technical leadership looks like at the next level. Where do you feel most confident, and where do you see gaps?\n\nPriya: I'm confident in the tactical execution. Where I need growth is in engineering culture - specifically, how to influence without direct authority.\n\nAlex Rivera: That's a sophisticated leadership challenge. At GrowthLabs, who are the key stakeholders you need to influence?\n\nPriya: The executive team, board members, and increasingly, external partners. It's a different game than what got me here.\n\nAlex Rivera: You're right - what got you here won't get you there. Let's design a development plan that addresses engineering culture and co-founder dynamics.\n\nPriya: I appreciate that you understand the nuances of my situation. The complexity at GrowthLabs isn't always obvious to outsiders.\n\nAlex Rivera: That's why our work together goes beyond generic leadership advice. We're crafting a path that's specific to Priya Sharma's journey at GrowthLabs.\n\n[Goal-setting framework discussion with SMART goals, accountability structures, and milestone planning]\n\nGoals Established:\n1. Master technical leadership fundamentals by end of Q1\n2. Build engineering culture influence map and engagement strategy\n3. Develop co-founder dynamics through deliberate practice\n4. Platform migration to Kubernetes - achieve key milestone by month-end\n\nSupport Needed:\n- Weekly check-ins during critical Platform migration to Kubernetes phases\n- Access to peer coaching cohort for technical leadership practitioners\n- Book recommendations on engineering culture",
      "uniqueMarker": "PRIYA_GROWTHLABS_UNIQUE_MARKER_8T4V",
      "secretProject": "Platform migration to Kubernetes",
      "themes": [
        "technical leadership",
        "engineering culture",
        "co-founder dynamics"
      ]
    },
    {
      "clientId": "550e8400-e29b-41d4-a716-446655440005",
      "clientName": "Priya Sharma",
      "coachId": "550e8400-e29b-41d4-a716-446655440010",
      "coachName": "Alex Rivera",
      "org": "GrowthLabs",
      "sessionDate": "2025-10-24T19:52:07.340Z",
      "sessionType": "breakthrough",
      "content": "Coaching Session: Breakthrough Moment\nClient: Priya Sharma, Co-founder & CTO at GrowthLabs\nCoach: Alex Rivera\nDate: 2025-10-24\nReference: PRIYA_GROWTHLABS_UNIQUE_MARKER_8T4V\n\nAlex Rivera: Priya! I can tell from your energy that something significant has happened. What's going on?\n\nPriya: Alex, I had a breakthrough! Everything we've been working on around technical leadership finally clicked in yesterday's board meeting.\n\nAlex Rivera: Tell me everything. What made the difference?\n\nPriya: Remember how we practiced reframing Platform migration to Kubernetes as a strategic opportunity rather than a challenge? I used that exact framework.\n\nAlex Rivera: How did the board respond?\n\nPriya: They were engaged in a way I haven't seen before. For the first time, they asked follow-up questions that showed they actually understood the vision.\n\nAlex Rivera: That's the power of co-founder dynamics - when you communicate with confidence and clarity, people lean in. What else contributed to this success?\n\nPriya: The preparation work we did on engineering culture. I anticipated their concerns and addressed them proactively.\n\nAlex Rivera: You've integrated multiple aspects of our work - technical leadership, engineering culture, co-founder dynamics. This is what mastery looks like.\n\nPriya: I feel like I've leveled up. The imposter syndrome that used to plague me before these meetings is significantly diminished.\n\nAlex Rivera: Let's anchor this win. What specific behaviors will you continue that led to this breakthrough?\n\nPriya: Pre-meeting preparation with stakeholder mapping, practicing my key messages out loud, and arriving with an abundance mindset rather than defensiveness.\n\nAlex Rivera: Those are powerful practices. How can you apply them to Platform migration to Kubernetes's next phase?\n\n[Discussion of applying breakthrough lessons to upcoming challenges]\n\nCelebration:\n- Board meeting success demonstrates growth in technical leadership and engineering culture and co-founder dynamics\n- Priya Sharma has internalized coaching frameworks\n- Ready for increased challenge level in future sessions\n\nNext Steps:\n- Document the breakthrough process for future reference\n- Apply same preparation framework to Platform migration to Kubernetes stakeholder presentations\n- Schedule debrief after next major GrowthLabs milestone",
      "uniqueMarker": "PRIYA_GROWTHLABS_UNIQUE_MARKER_8T4V",
      "secretProject": "Platform migration to Kubernetes",
      "themes": [
        "technical leadership",
        "engineering culture",
        "co-founder dynamics"
      ]
    },
    {
      "clientId": "550e8400-e29b-41d4-a716-446655440006",
      "clientName": "Marcus Johnson",
      "coachId": "550e8400-e29b-41d4-a716-446655440010",
      "coachName": "Alex Rivera",
      "org": "ScaleUp Ventures",
      "sessionDate": "2025-07-14T04:48:26.571Z",
      "sessionType": "quarterly-review",
      "content": "Coaching Session: Quarterly Review\nClient: Marcus Johnson, Founder & CEO at ScaleUp Ventures\nCoach: Alex Rivera\nDate: 2025-07-14\nSession Marker: MARCUS_SCALEUP_UNIQUE_MARKER_2R6Y\n\nAlex Rivera: Welcome back, Marcus. I've been looking forward to our quarterly review. How are you feeling about the progress we've made?\n\nMarcus: Thank you, Alex. It's been an intense quarter. Banking license application has consumed most of my bandwidth, but I feel like we're making real progress.\n\nAlex Rivera: Tell me more about Banking license application. What's working well?\n\nMarcus: The team is finally aligned. We had some resistance initially, especially around fintech regulations, but after our last session where you helped me reframe the narrative, things clicked.\n\nAlex Rivera: I'm glad that fintech regulations framework is paying off. What challenges remain?\n\nMarcus: Honestly, the biggest challenge is investor relations. As we scale, I'm finding it harder to maintain the quality of interactions with my team.\n\nAlex Rivera: Let's dig into that. When you say investor relations, what specifically concerns you?\n\nMarcus: I used to have weekly 1:1s with everyone. Now with the growth, it's impossible. I'm worried about losing touch with the pulse of the organization.\n\nAlex Rivera: This is a common inflection point for leaders at your stage. Let me share a model that's helped other executives I've worked with...\n\n[Session continues with detailed discussion of leadership scaling strategies, action items, and next steps related to fintech regulations, investor relations, personal brand]\n\nAction Items:\n1. Implement skip-level meetings every two weeks\n2. Create a \"listening tour\" schedule for Q2\n3. Document Banking license application milestones for board presentation\n4. Practice personal brand exercises before next town hall\n\nNext session: Focus on personal brand development",
      "uniqueMarker": "MARCUS_SCALEUP_UNIQUE_MARKER_2R6Y",
      "secretProject": "Banking license application",
      "themes": [
        "fintech regulations",
        "investor relations",
        "personal brand"
      ]
    },
    {
      "clientId": "550e8400-e29b-41d4-a716-446655440006",
      "clientName": "Marcus Johnson",
      "coachId": "550e8400-e29b-41d4-a716-446655440010",
      "coachName": "Alex Rivera",
      "org": "ScaleUp Ventures",
      "sessionDate": "2025-08-19T07:41:37.128Z",
      "sessionType": "challenge-session",
      "content": "Coaching Session: Challenge Deep-Dive\nClient: Marcus Johnson, Founder & CEO at ScaleUp Ventures\nCoach: Alex Rivera\nDate: 2025-08-19\nUnique Identifier: MARCUS_SCALEUP_UNIQUE_MARKER_2R6Y\n\nAlex Rivera: Marcus, you mentioned in your pre-session notes that you're facing a significant challenge with fintech regulations. Walk me through what's happening.\n\nMarcus: Alex, I'm at a crossroads. Banking license application has hit a major roadblock. The board is asking tough questions, and I'm not sure I have the answers.\n\nAlex Rivera: Let's break this down. What exactly is the board concerned about?\n\nMarcus: They want to see faster progress on investor relations. Our metrics aren't where we projected them to be.\n\nAlex Rivera: When you think about investor relations in the context of ScaleUp Ventures's current stage, what does success actually look like?\n\nMarcus: That's a good question. I think I've been measuring myself against industry benchmarks that don't apply to our unique situation.\n\nAlex Rivera: Exactly. Let's redefine success metrics that align with ScaleUp Ventures's specific context. What would you say are the three most critical indicators?\n\nMarcus: For Banking license application specifically, I'd say: customer retention, team velocity, and stakeholder confidence.\n\nAlex Rivera: Now we're getting somewhere. How do these connect to your work on personal brand?\n\nMarcus: personal brand is the thread that ties it all together. If I can improve that, everything else follows.\n\nAlex Rivera: What's one action you could take this week that would move the needle on personal brand?\n\nMarcus: I've been avoiding a difficult conversation with my leadership team about expectations. That needs to happen.\n\nAlex Rivera: Tell me about your hesitation around that conversation.\n\n[Detailed exploration of communication patterns, stakeholder management, and executive presence development]\n\nKey Insights:\n- Marcus Johnson recognizes the need for clearer metrics alignment\n- Banking license application requires reframing for stakeholder buy-in\n- personal brand is the critical development area for next quarter\n\nFollow-up: Schedule role-play session for difficult conversation practice",
      "uniqueMarker": "MARCUS_SCALEUP_UNIQUE_MARKER_2R6Y",
      "secretProject": "Banking license application",
      "themes": [
        "fintech regulations",
        "investor relations",
        "personal brand"
      ]
    },
    {
      "clientId": "550e8400-e29b-41d4-a716-446655440006",
      "clientName": "Marcus Johnson",
      "coachId": "550e8400-e29b-41d4-a716-446655440010",
      "coachName": "Alex Rivera",
      "org": "ScaleUp Ventures",
      "sessionDate": "2025-09-13T03:33:26.848Z",
      "sessionType": "goal-setting",
      "content": "Coaching Session: Goal Alignment & Planning\nClient: Marcus Johnson, Founder & CEO at ScaleUp Ventures\nCoach: Alex Rivera\nDate: 2025-09-13\nSession ID: MARCUS_SCALEUP_UNIQUE_MARKER_2R6Y\n\nAlex Rivera: Marcus, as we enter this new planning cycle, I want to make sure our coaching goals are aligned with what matters most to you professionally and personally.\n\nMarcus: Alex, that's perfect timing. ScaleUp Ventures is going through major changes, and I need to recalibrate.\n\nAlex Rivera: What's driving that need for recalibration?\n\nMarcus: Banking license application is entering its critical phase. My role is expanding, and I need to develop new capabilities, particularly in fintech regulations.\n\nAlex Rivera: Let's map out what fintech regulations looks like at the next level. Where do you feel most confident, and where do you see gaps?\n\nMarcus: I'm confident in the tactical execution. Where I need growth is in investor relations - specifically, how to influence without direct authority.\n\nAlex Rivera: That's a sophisticated leadership challenge. At ScaleUp Ventures, who are the key stakeholders you need to influence?\n\nMarcus: The executive team, board members, and increasingly, external partners. It's a different game than what got me here.\n\nAlex Rivera: You're right - what got you here won't get you there. Let's design a development plan that addresses investor relations and personal brand.\n\nMarcus: I appreciate that you understand the nuances of my situation. The complexity at ScaleUp Ventures isn't always obvious to outsiders.\n\nAlex Rivera: That's why our work together goes beyond generic leadership advice. We're crafting a path that's specific to Marcus Johnson's journey at ScaleUp Ventures.\n\n[Goal-setting framework discussion with SMART goals, accountability structures, and milestone planning]\n\nGoals Established:\n1. Master fintech regulations fundamentals by end of Q1\n2. Build investor relations influence map and engagement strategy\n3. Develop personal brand through deliberate practice\n4. Banking license application - achieve key milestone by month-end\n\nSupport Needed:\n- Weekly check-ins during critical Banking license application phases\n- Access to peer coaching cohort for fintech regulations practitioners\n- Book recommendations on investor relations",
      "uniqueMarker": "MARCUS_SCALEUP_UNIQUE_MARKER_2R6Y",
      "secretProject": "Banking license application",
      "themes": [
        "fintech regulations",
        "investor relations",
        "personal brand"
      ]
    },
    {
      "clientId": "550e8400-e29b-41d4-a716-446655440006",
      "clientName": "Marcus Johnson",
      "coachId": "550e8400-e29b-41d4-a716-446655440010",
      "coachName": "Alex Rivera",
      "org": "ScaleUp Ventures",
      "sessionDate": "2025-09-17T13:09:02.693Z",
      "sessionType": "breakthrough",
      "content": "Coaching Session: Breakthrough Moment\nClient: Marcus Johnson, Founder & CEO at ScaleUp Ventures\nCoach: Alex Rivera\nDate: 2025-09-17\nReference: MARCUS_SCALEUP_UNIQUE_MARKER_2R6Y\n\nAlex Rivera: Marcus! I can tell from your energy that something significant has happened. What's going on?\n\nMarcus: Alex, I had a breakthrough! Everything we've been working on around fintech regulations finally clicked in yesterday's board meeting.\n\nAlex Rivera: Tell me everything. What made the difference?\n\nMarcus: Remember how we practiced reframing Banking license application as a strategic opportunity rather than a challenge? I used that exact framework.\n\nAlex Rivera: How did the board respond?\n\nMarcus: They were engaged in a way I haven't seen before. For the first time, they asked follow-up questions that showed they actually understood the vision.\n\nAlex Rivera: That's the power of personal brand - when you communicate with confidence and clarity, people lean in. What else contributed to this success?\n\nMarcus: The preparation work we did on investor relations. I anticipated their concerns and addressed them proactively.\n\nAlex Rivera: You've integrated multiple aspects of our work - fintech regulations, investor relations, personal brand. This is what mastery looks like.\n\nMarcus: I feel like I've leveled up. The imposter syndrome that used to plague me before these meetings is significantly diminished.\n\nAlex Rivera: Let's anchor this win. What specific behaviors will you continue that led to this breakthrough?\n\nMarcus: Pre-meeting preparation with stakeholder mapping, practicing my key messages out loud, and arriving with an abundance mindset rather than defensiveness.\n\nAlex Rivera: Those are powerful practices. How can you apply them to Banking license application's next phase?\n\n[Discussion of applying breakthrough lessons to upcoming challenges]\n\nCelebration:\n- Board meeting success demonstrates growth in fintech regulations and investor relations and personal brand\n- Marcus Johnson has internalized coaching frameworks\n- Ready for increased challenge level in future sessions\n\nNext Steps:\n- Document the breakthrough process for future reference\n- Apply same preparation framework to Banking license application stakeholder presentations\n- Schedule debrief after next major ScaleUp Ventures milestone",
      "uniqueMarker": "MARCUS_SCALEUP_UNIQUE_MARKER_2R6Y",
      "secretProject": "Banking license application",
      "themes": [
        "fintech regulations",
        "investor relations",
        "personal brand"
      ]
    },
    {
      "clientId": "550e8400-e29b-41d4-a716-446655440004",
      "clientName": "David Kim",
      "coachId": "550e8400-e29b-41d4-a716-446655440012",
      "coachName": "Jordan Taylor",
      "org": "TechCorp Inc",
      "sessionDate": "2025-07-25T13:16:13.298Z",
      "sessionType": "quarterly-review",
      "content": "Coaching Session: Quarterly Review\nClient: David Kim, VP of Sales at TechCorp Inc\nCoach: Jordan Taylor\nDate: 2025-07-25\nSession Marker: DAVID_TECHCORP_UNIQUE_MARKER_5N1Q\n\nJordan Taylor: Welcome back, David. I've been looking forward to our quarterly review. How are you feeling about the progress we've made?\n\nDavid: Thank you, Jordan. It's been an intense quarter. Enterprise expansion - Fortune 500 strategy has consumed most of my bandwidth, but I feel like we're making real progress.\n\nJordan Taylor: Tell me more about Enterprise expansion - Fortune 500 strategy. What's working well?\n\nDavid: The team is finally aligned. We had some resistance initially, especially around sales leadership, but after our last session where you helped me reframe the narrative, things clicked.\n\nJordan Taylor: I'm glad that sales leadership framework is paying off. What challenges remain?\n\nDavid: Honestly, the biggest challenge is quota management. As we scale, I'm finding it harder to maintain the quality of interactions with my team.\n\nJordan Taylor: Let's dig into that. When you say quota management, what specifically concerns you?\n\nDavid: I used to have weekly 1:1s with everyone. Now with the growth, it's impossible. I'm worried about losing touch with the pulse of the organization.\n\nJordan Taylor: This is a common inflection point for leaders at your stage. Let me share a model that's helped other executives I've worked with...\n\n[Session continues with detailed discussion of leadership scaling strategies, action items, and next steps related to sales leadership, quota management, enterprise deals]\n\nAction Items:\n1. Implement skip-level meetings every two weeks\n2. Create a \"listening tour\" schedule for Q2\n3. Document Enterprise expansion - Fortune 500 strategy milestones for board presentation\n4. Practice enterprise deals exercises before next town hall\n\nNext session: Focus on enterprise deals development",
      "uniqueMarker": "DAVID_TECHCORP_UNIQUE_MARKER_5N1Q",
      "secretProject": "Enterprise expansion - Fortune 500 strategy",
      "themes": [
        "sales leadership",
        "quota management",
        "enterprise deals"
      ]
    },
    {
      "clientId": "550e8400-e29b-41d4-a716-446655440004",
      "clientName": "David Kim",
      "coachId": "550e8400-e29b-41d4-a716-446655440012",
      "coachName": "Jordan Taylor",
      "org": "TechCorp Inc",
      "sessionDate": "2025-07-26T16:58:11.332Z",
      "sessionType": "challenge-session",
      "content": "Coaching Session: Challenge Deep-Dive\nClient: David Kim, VP of Sales at TechCorp Inc\nCoach: Jordan Taylor\nDate: 2025-07-26\nUnique Identifier: DAVID_TECHCORP_UNIQUE_MARKER_5N1Q\n\nJordan Taylor: David, you mentioned in your pre-session notes that you're facing a significant challenge with sales leadership. Walk me through what's happening.\n\nDavid: Jordan, I'm at a crossroads. Enterprise expansion - Fortune 500 strategy has hit a major roadblock. The board is asking tough questions, and I'm not sure I have the answers.\n\nJordan Taylor: Let's break this down. What exactly is the board concerned about?\n\nDavid: They want to see faster progress on quota management. Our metrics aren't where we projected them to be.\n\nJordan Taylor: When you think about quota management in the context of TechCorp Inc's current stage, what does success actually look like?\n\nDavid: That's a good question. I think I've been measuring myself against industry benchmarks that don't apply to our unique situation.\n\nJordan Taylor: Exactly. Let's redefine success metrics that align with TechCorp Inc's specific context. What would you say are the three most critical indicators?\n\nDavid: For Enterprise expansion - Fortune 500 strategy specifically, I'd say: customer retention, team velocity, and stakeholder confidence.\n\nJordan Taylor: Now we're getting somewhere. How do these connect to your work on enterprise deals?\n\nDavid: enterprise deals is the thread that ties it all together. If I can improve that, everything else follows.\n\nJordan Taylor: What's one action you could take this week that would move the needle on enterprise deals?\n\nDavid: I've been avoiding a difficult conversation with my leadership team about expectations. That needs to happen.\n\nJordan Taylor: Tell me about your hesitation around that conversation.\n\n[Detailed exploration of communication patterns, stakeholder management, and executive presence development]\n\nKey Insights:\n- David Kim recognizes the need for clearer metrics alignment\n- Enterprise expansion - Fortune 500 strategy requires reframing for stakeholder buy-in\n- enterprise deals is the critical development area for next quarter\n\nFollow-up: Schedule role-play session for difficult conversation practice",
      "uniqueMarker": "DAVID_TECHCORP_UNIQUE_MARKER_5N1Q",
      "secretProject": "Enterprise expansion - Fortune 500 strategy",
      "themes": [
        "sales leadership",
        "quota management",
        "enterprise deals"
      ]
    },
    {
      "clientId": "550e8400-e29b-41d4-a716-446655440004",
      "clientName": "David Kim",
      "coachId": "550e8400-e29b-41d4-a716-446655440012",
      "coachName": "Jordan Taylor",
      "org": "TechCorp Inc",
      "sessionDate": "2025-08-23T06:56:13.571Z",
      "sessionType": "goal-setting",
      "content": "Coaching Session: Goal Alignment & Planning\nClient: David Kim, VP of Sales at TechCorp Inc\nCoach: Jordan Taylor\nDate: 2025-08-23\nSession ID: DAVID_TECHCORP_UNIQUE_MARKER_5N1Q\n\nJordan Taylor: David, as we enter this new planning cycle, I want to make sure our coaching goals are aligned with what matters most to you professionally and personally.\n\nDavid: Jordan, that's perfect timing. TechCorp Inc is going through major changes, and I need to recalibrate.\n\nJordan Taylor: What's driving that need for recalibration?\n\nDavid: Enterprise expansion - Fortune 500 strategy is entering its critical phase. My role is expanding, and I need to develop new capabilities, particularly in sales leadership.\n\nJordan Taylor: Let's map out what sales leadership looks like at the next level. Where do you feel most confident, and where do you see gaps?\n\nDavid: I'm confident in the tactical execution. Where I need growth is in quota management - specifically, how to influence without direct authority.\n\nJordan Taylor: That's a sophisticated leadership challenge. At TechCorp Inc, who are the key stakeholders you need to influence?\n\nDavid: The executive team, board members, and increasingly, external partners. It's a different game than what got me here.\n\nJordan Taylor: You're right - what got you here won't get you there. Let's design a development plan that addresses quota management and enterprise deals.\n\nDavid: I appreciate that you understand the nuances of my situation. The complexity at TechCorp Inc isn't always obvious to outsiders.\n\nJordan Taylor: That's why our work together goes beyond generic leadership advice. We're crafting a path that's specific to David Kim's journey at TechCorp Inc.\n\n[Goal-setting framework discussion with SMART goals, accountability structures, and milestone planning]\n\nGoals Established:\n1. Master sales leadership fundamentals by end of Q1\n2. Build quota management influence map and engagement strategy\n3. Develop enterprise deals through deliberate practice\n4. Enterprise expansion - Fortune 500 strategy - achieve key milestone by month-end\n\nSupport Needed:\n- Weekly check-ins during critical Enterprise expansion - Fortune 500 strategy phases\n- Access to peer coaching cohort for sales leadership practitioners\n- Book recommendations on quota management",
      "uniqueMarker": "DAVID_TECHCORP_UNIQUE_MARKER_5N1Q",
      "secretProject": "Enterprise expansion - Fortune 500 strategy",
      "themes": [
        "sales leadership",
        "quota management",
        "enterprise deals"
      ]
    },
    {
      "clientId": "550e8400-e29b-41d4-a716-446655440004",
      "clientName": "David Kim",
      "coachId": "550e8400-e29b-41d4-a716-446655440012",
      "coachName": "Jordan Taylor",
      "org": "TechCorp Inc",
      "sessionDate": "2025-08-27T15:49:21.226Z",
      "sessionType": "breakthrough",
      "content": "Coaching Session: Breakthrough Moment\nClient: David Kim, VP of Sales at TechCorp Inc\nCoach: Jordan Taylor\nDate: 2025-08-27\nReference: DAVID_TECHCORP_UNIQUE_MARKER_5N1Q\n\nJordan Taylor: David! I can tell from your energy that something significant has happened. What's going on?\n\nDavid: Jordan, I had a breakthrough! Everything we've been working on around sales leadership finally clicked in yesterday's board meeting.\n\nJordan Taylor: Tell me everything. What made the difference?\n\nDavid: Remember how we practiced reframing Enterprise expansion - Fortune 500 strategy as a strategic opportunity rather than a challenge? I used that exact framework.\n\nJordan Taylor: How did the board respond?\n\nDavid: They were engaged in a way I haven't seen before. For the first time, they asked follow-up questions that showed they actually understood the vision.\n\nJordan Taylor: That's the power of enterprise deals - when you communicate with confidence and clarity, people lean in. What else contributed to this success?\n\nDavid: The preparation work we did on quota management. I anticipated their concerns and addressed them proactively.\n\nJordan Taylor: You've integrated multiple aspects of our work - sales leadership, quota management, enterprise deals. This is what mastery looks like.\n\nDavid: I feel like I've leveled up. The imposter syndrome that used to plague me before these meetings is significantly diminished.\n\nJordan Taylor: Let's anchor this win. What specific behaviors will you continue that led to this breakthrough?\n\nDavid: Pre-meeting preparation with stakeholder mapping, practicing my key messages out loud, and arriving with an abundance mindset rather than defensiveness.\n\nJordan Taylor: Those are powerful practices. How can you apply them to Enterprise expansion - Fortune 500 strategy's next phase?\n\n[Discussion of applying breakthrough lessons to upcoming challenges]\n\nCelebration:\n- Board meeting success demonstrates growth in sales leadership and quota management and enterprise deals\n- David Kim has internalized coaching frameworks\n- Ready for increased challenge level in future sessions\n\nNext Steps:\n- Document the breakthrough process for future reference\n- Apply same preparation framework to Enterprise expansion - Fortune 500 strategy stakeholder presentations\n- Schedule debrief after next major TechCorp Inc milestone",
      "uniqueMarker": "DAVID_TECHCORP_UNIQUE_MARKER_5N1Q",
      "secretProject": "Enterprise expansion - Fortune 500 strategy",
      "themes": [
        "sales leadership",
        "quota management",
        "enterprise deals"
      ]
    },
    {
      "clientId": "550e8400-e29b-41d4-a716-446655440007",
      "clientName": "Lisa Park",
      "coachId": "550e8400-e29b-41d4-a716-446655440012",
      "coachName": "Jordan Taylor",
      "org": "GrowthLabs",
      "sessionDate": "2025-06-02T11:33:07.871Z",
      "sessionType": "quarterly-review",
      "content": "Coaching Session: Quarterly Review\nClient: Lisa Park, VP of Engineering at GrowthLabs\nCoach: Jordan Taylor\nDate: 2025-06-02\nSession Marker: LISA_GROWTHLABS_UNIQUE_MARKER_9W3Z\n\nJordan Taylor: Welcome back, Lisa. I've been looking forward to our quarterly review. How are you feeling about the progress we've made?\n\nLisa: Thank you, Jordan. It's been an intense quarter. AI/ML team buildout has consumed most of my bandwidth, but I feel like we're making real progress.\n\nJordan Taylor: Tell me more about AI/ML team buildout. What's working well?\n\nLisa: The team is finally aligned. We had some resistance initially, especially around engineering management, but after our last session where you helped me reframe the narrative, things clicked.\n\nJordan Taylor: I'm glad that engineering management framework is paying off. What challenges remain?\n\nLisa: Honestly, the biggest challenge is technical debt. As we scale, I'm finding it harder to maintain the quality of interactions with my team.\n\nJordan Taylor: Let's dig into that. When you say technical debt, what specifically concerns you?\n\nLisa: I used to have weekly 1:1s with everyone. Now with the growth, it's impossible. I'm worried about losing touch with the pulse of the organization.\n\nJordan Taylor: This is a common inflection point for leaders at your stage. Let me share a model that's helped other executives I've worked with...\n\n[Session continues with detailed discussion of leadership scaling strategies, action items, and next steps related to engineering management, technical debt, hiring strategy]\n\nAction Items:\n1. Implement skip-level meetings every two weeks\n2. Create a \"listening tour\" schedule for Q2\n3. Document AI/ML team buildout milestones for board presentation\n4. Practice hiring strategy exercises before next town hall\n\nNext session: Focus on hiring strategy development",
      "uniqueMarker": "LISA_GROWTHLABS_UNIQUE_MARKER_9W3Z",
      "secretProject": "AI/ML team buildout",
      "themes": [
        "engineering management",
        "technical debt",
        "hiring strategy"
      ]
    },
    {
      "clientId": "550e8400-e29b-41d4-a716-446655440007",
      "clientName": "Lisa Park",
      "coachId": "550e8400-e29b-41d4-a716-446655440012",
      "coachName": "Jordan Taylor",
      "org": "GrowthLabs",
      "sessionDate": "2025-07-12T12:36:01.858Z",
      "sessionType": "challenge-session",
      "content": "Coaching Session: Challenge Deep-Dive\nClient: Lisa Park, VP of Engineering at GrowthLabs\nCoach: Jordan Taylor\nDate: 2025-07-12\nUnique Identifier: LISA_GROWTHLABS_UNIQUE_MARKER_9W3Z\n\nJordan Taylor: Lisa, you mentioned in your pre-session notes that you're facing a significant challenge with engineering management. Walk me through what's happening.\n\nLisa: Jordan, I'm at a crossroads. AI/ML team buildout has hit a major roadblock. The board is asking tough questions, and I'm not sure I have the answers.\n\nJordan Taylor: Let's break this down. What exactly is the board concerned about?\n\nLisa: They want to see faster progress on technical debt. Our metrics aren't where we projected them to be.\n\nJordan Taylor: When you think about technical debt in the context of GrowthLabs's current stage, what does success actually look like?\n\nLisa: That's a good question. I think I've been measuring myself against industry benchmarks that don't apply to our unique situation.\n\nJordan Taylor: Exactly. Let's redefine success metrics that align with GrowthLabs's specific context. What would you say are the three most critical indicators?\n\nLisa: For AI/ML team buildout specifically, I'd say: customer retention, team velocity, and stakeholder confidence.\n\nJordan Taylor: Now we're getting somewhere. How do these connect to your work on hiring strategy?\n\nLisa: hiring strategy is the thread that ties it all together. If I can improve that, everything else follows.\n\nJordan Taylor: What's one action you could take this week that would move the needle on hiring strategy?\n\nLisa: I've been avoiding a difficult conversation with my leadership team about expectations. That needs to happen.\n\nJordan Taylor: Tell me about your hesitation around that conversation.\n\n[Detailed exploration of communication patterns, stakeholder management, and executive presence development]\n\nKey Insights:\n- Lisa Park recognizes the need for clearer metrics alignment\n- AI/ML team buildout requires reframing for stakeholder buy-in\n- hiring strategy is the critical development area for next quarter\n\nFollow-up: Schedule role-play session for difficult conversation practice",
      "uniqueMarker": "LISA_GROWTHLABS_UNIQUE_MARKER_9W3Z",
      "secretProject": "AI/ML team buildout",
      "themes": [
        "engineering management",
        "technical debt",
        "hiring strategy"
      ]
    },
    {
      "clientId": "550e8400-e29b-41d4-a716-446655440007",
      "clientName": "Lisa Park",
      "coachId": "550e8400-e29b-41d4-a716-446655440012",
      "coachName": "Jordan Taylor",
      "org": "GrowthLabs",
      "sessionDate": "2025-07-20T05:37:07.276Z",
      "sessionType": "goal-setting",
      "content": "Coaching Session: Goal Alignment & Planning\nClient: Lisa Park, VP of Engineering at GrowthLabs\nCoach: Jordan Taylor\nDate: 2025-07-20\nSession ID: LISA_GROWTHLABS_UNIQUE_MARKER_9W3Z\n\nJordan Taylor: Lisa, as we enter this new planning cycle, I want to make sure our coaching goals are aligned with what matters most to you professionally and personally.\n\nLisa: Jordan, that's perfect timing. GrowthLabs is going through major changes, and I need to recalibrate.\n\nJordan Taylor: What's driving that need for recalibration?\n\nLisa: AI/ML team buildout is entering its critical phase. My role is expanding, and I need to develop new capabilities, particularly in engineering management.\n\nJordan Taylor: Let's map out what engineering management looks like at the next level. Where do you feel most confident, and where do you see gaps?\n\nLisa: I'm confident in the tactical execution. Where I need growth is in technical debt - specifically, how to influence without direct authority.\n\nJordan Taylor: That's a sophisticated leadership challenge. At GrowthLabs, who are the key stakeholders you need to influence?\n\nLisa: The executive team, board members, and increasingly, external partners. It's a different game than what got me here.\n\nJordan Taylor: You're right - what got you here won't get you there. Let's design a development plan that addresses technical debt and hiring strategy.\n\nLisa: I appreciate that you understand the nuances of my situation. The complexity at GrowthLabs isn't always obvious to outsiders.\n\nJordan Taylor: That's why our work together goes beyond generic leadership advice. We're crafting a path that's specific to Lisa Park's journey at GrowthLabs.\n\n[Goal-setting framework discussion with SMART goals, accountability structures, and milestone planning]\n\nGoals Established:\n1. Master engineering management fundamentals by end of Q1\n2. Build technical debt influence map and engagement strategy\n3. Develop hiring strategy through deliberate practice\n4. AI/ML team buildout - achieve key milestone by month-end\n\nSupport Needed:\n- Weekly check-ins during critical AI/ML team buildout phases\n- Access to peer coaching cohort for engineering management practitioners\n- Book recommendations on technical debt",
      "uniqueMarker": "LISA_GROWTHLABS_UNIQUE_MARKER_9W3Z",
      "secretProject": "AI/ML team buildout",
      "themes": [
        "engineering management",
        "technical debt",
        "hiring strategy"
      ]
    },
    {
      "clientId": "550e8400-e29b-41d4-a716-446655440007",
      "clientName": "Lisa Park",
      "coachId": "550e8400-e29b-41d4-a716-446655440012",
      "coachName": "Jordan Taylor",
      "org": "GrowthLabs",
      "sessionDate": "2025-10-22T11:20:02.244Z",
      "sessionType": "breakthrough",
      "content": "Coaching Session: Breakthrough Moment\nClient: Lisa Park, VP of Engineering at GrowthLabs\nCoach: Jordan Taylor\nDate: 2025-10-22\nReference: LISA_GROWTHLABS_UNIQUE_MARKER_9W3Z\n\nJordan Taylor: Lisa! I can tell from your energy that something significant has happened. What's going on?\n\nLisa: Jordan, I had a breakthrough! Everything we've been working on around engineering management finally clicked in yesterday's board meeting.\n\nJordan Taylor: Tell me everything. What made the difference?\n\nLisa: Remember how we practiced reframing AI/ML team buildout as a strategic opportunity rather than a challenge? I used that exact framework.\n\nJordan Taylor: How did the board respond?\n\nLisa: They were engaged in a way I haven't seen before. For the first time, they asked follow-up questions that showed they actually understood the vision.\n\nJordan Taylor: That's the power of hiring strategy - when you communicate with confidence and clarity, people lean in. What else contributed to this success?\n\nLisa: The preparation work we did on technical debt. I anticipated their concerns and addressed them proactively.\n\nJordan Taylor: You've integrated multiple aspects of our work - engineering management, technical debt, hiring strategy. This is what mastery looks like.\n\nLisa: I feel like I've leveled up. The imposter syndrome that used to plague me before these meetings is significantly diminished.\n\nJordan Taylor: Let's anchor this win. What specific behaviors will you continue that led to this breakthrough?\n\nLisa: Pre-meeting preparation with stakeholder mapping, practicing my key messages out loud, and arriving with an abundance mindset rather than defensiveness.\n\nJordan Taylor: Those are powerful practices. How can you apply them to AI/ML team buildout's next phase?\n\n[Discussion of applying breakthrough lessons to upcoming challenges]\n\nCelebration:\n- Board meeting success demonstrates growth in engineering management and technical debt and hiring strategy\n- Lisa Park has internalized coaching frameworks\n- Ready for increased challenge level in future sessions\n\nNext Steps:\n- Document the breakthrough process for future reference\n- Apply same preparation framework to AI/ML team buildout stakeholder presentations\n- Schedule debrief after next major GrowthLabs milestone",
      "uniqueMarker": "LISA_GROWTHLABS_UNIQUE_MARKER_9W3Z",
      "secretProject": "AI/ML team buildout",
      "themes": [
        "engineering management",
        "technical debt",
        "hiring strategy"
      ]
    },
    {
      "clientId": "550e8400-e29b-41d4-a716-446655440008",
      "clientName": "James Wilson",
      "coachId": "550e8400-e29b-41d4-a716-446655440012",
      "coachName": "Jordan Taylor",
      "org": "Innovate Partners",
      "sessionDate": "2025-06-20T23:41:29.618Z",
      "sessionType": "quarterly-review",
      "content": "Coaching Session: Quarterly Review\nClient: James Wilson, Managing Partner at Innovate Partners\nCoach: Jordan Taylor\nDate: 2025-06-20\nSession Marker: JAMES_INNOVATE_UNIQUE_MARKER_4H8B\n\nJordan Taylor: Welcome back, James. I've been looking forward to our quarterly review. How are you feeling about the progress we've made?\n\nJames: Thank you, Jordan. It's been an intense quarter. European market expansion has consumed most of my bandwidth, but I feel like we're making real progress.\n\nJordan Taylor: Tell me more about European market expansion. What's working well?\n\nJames: The team is finally aligned. We had some resistance initially, especially around partnership dynamics, but after our last session where you helped me reframe the narrative, things clicked.\n\nJordan Taylor: I'm glad that partnership dynamics framework is paying off. What challenges remain?\n\nJames: Honestly, the biggest challenge is client acquisition. As we scale, I'm finding it harder to maintain the quality of interactions with my team.\n\nJordan Taylor: Let's dig into that. When you say client acquisition, what specifically concerns you?\n\nJames: I used to have weekly 1:1s with everyone. Now with the growth, it's impossible. I'm worried about losing touch with the pulse of the organization.\n\nJordan Taylor: This is a common inflection point for leaders at your stage. Let me share a model that's helped other executives I've worked with...\n\n[Session continues with detailed discussion of leadership scaling strategies, action items, and next steps related to partnership dynamics, client acquisition, thought leadership]\n\nAction Items:\n1. Implement skip-level meetings every two weeks\n2. Create a \"listening tour\" schedule for Q2\n3. Document European market expansion milestones for board presentation\n4. Practice thought leadership exercises before next town hall\n\nNext session: Focus on thought leadership development",
      "uniqueMarker": "JAMES_INNOVATE_UNIQUE_MARKER_4H8B",
      "secretProject": "European market expansion",
      "themes": [
        "partnership dynamics",
        "client acquisition",
        "thought leadership"
      ]
    },
    {
      "clientId": "550e8400-e29b-41d4-a716-446655440008",
      "clientName": "James Wilson",
      "coachId": "550e8400-e29b-41d4-a716-446655440012",
      "coachName": "Jordan Taylor",
      "org": "Innovate Partners",
      "sessionDate": "2025-10-09T10:52:51.892Z",
      "sessionType": "challenge-session",
      "content": "Coaching Session: Challenge Deep-Dive\nClient: James Wilson, Managing Partner at Innovate Partners\nCoach: Jordan Taylor\nDate: 2025-10-09\nUnique Identifier: JAMES_INNOVATE_UNIQUE_MARKER_4H8B\n\nJordan Taylor: James, you mentioned in your pre-session notes that you're facing a significant challenge with partnership dynamics. Walk me through what's happening.\n\nJames: Jordan, I'm at a crossroads. European market expansion has hit a major roadblock. The board is asking tough questions, and I'm not sure I have the answers.\n\nJordan Taylor: Let's break this down. What exactly is the board concerned about?\n\nJames: They want to see faster progress on client acquisition. Our metrics aren't where we projected them to be.\n\nJordan Taylor: When you think about client acquisition in the context of Innovate Partners's current stage, what does success actually look like?\n\nJames: That's a good question. I think I've been measuring myself against industry benchmarks that don't apply to our unique situation.\n\nJordan Taylor: Exactly. Let's redefine success metrics that align with Innovate Partners's specific context. What would you say are the three most critical indicators?\n\nJames: For European market expansion specifically, I'd say: customer retention, team velocity, and stakeholder confidence.\n\nJordan Taylor: Now we're getting somewhere. How do these connect to your work on thought leadership?\n\nJames: thought leadership is the thread that ties it all together. If I can improve that, everything else follows.\n\nJordan Taylor: What's one action you could take this week that would move the needle on thought leadership?\n\nJames: I've been avoiding a difficult conversation with my leadership team about expectations. That needs to happen.\n\nJordan Taylor: Tell me about your hesitation around that conversation.\n\n[Detailed exploration of communication patterns, stakeholder management, and executive presence development]\n\nKey Insights:\n- James Wilson recognizes the need for clearer metrics alignment\n- European market expansion requires reframing for stakeholder buy-in\n- thought leadership is the critical development area for next quarter\n\nFollow-up: Schedule role-play session for difficult conversation practice",
      "uniqueMarker": "JAMES_INNOVATE_UNIQUE_MARKER_4H8B",
      "secretProject": "European market expansion",
      "themes": [
        "partnership dynamics",
        "client acquisition",
        "thought leadership"
      ]
    },
    {
      "clientId": "550e8400-e29b-41d4-a716-446655440008",
      "clientName": "James Wilson",
      "coachId": "550e8400-e29b-41d4-a716-446655440012",
      "coachName": "Jordan Taylor",
      "org": "Innovate Partners",
      "sessionDate": "2025-10-14T21:15:16.417Z",
      "sessionType": "goal-setting",
      "content": "Coaching Session: Goal Alignment & Planning\nClient: James Wilson, Managing Partner at Innovate Partners\nCoach: Jordan Taylor\nDate: 2025-10-14\nSession ID: JAMES_INNOVATE_UNIQUE_MARKER_4H8B\n\nJordan Taylor: James, as we enter this new planning cycle, I want to make sure our coaching goals are aligned with what matters most to you professionally and personally.\n\nJames: Jordan, that's perfect timing. Innovate Partners is going through major changes, and I need to recalibrate.\n\nJordan Taylor: What's driving that need for recalibration?\n\nJames: European market expansion is entering its critical phase. My role is expanding, and I need to develop new capabilities, particularly in partnership dynamics.\n\nJordan Taylor: Let's map out what partnership dynamics looks like at the next level. Where do you feel most confident, and where do you see gaps?\n\nJames: I'm confident in the tactical execution. Where I need growth is in client acquisition - specifically, how to influence without direct authority.\n\nJordan Taylor: That's a sophisticated leadership challenge. At Innovate Partners, who are the key stakeholders you need to influence?\n\nJames: The executive team, board members, and increasingly, external partners. It's a different game than what got me here.\n\nJordan Taylor: You're right - what got you here won't get you there. Let's design a development plan that addresses client acquisition and thought leadership.\n\nJames: I appreciate that you understand the nuances of my situation. The complexity at Innovate Partners isn't always obvious to outsiders.\n\nJordan Taylor: That's why our work together goes beyond generic leadership advice. We're crafting a path that's specific to James Wilson's journey at Innovate Partners.\n\n[Goal-setting framework discussion with SMART goals, accountability structures, and milestone planning]\n\nGoals Established:\n1. Master partnership dynamics fundamentals by end of Q1\n2. Build client acquisition influence map and engagement strategy\n3. Develop thought leadership through deliberate practice\n4. European market expansion - achieve key milestone by month-end\n\nSupport Needed:\n- Weekly check-ins during critical European market expansion phases\n- Access to peer coaching cohort for partnership dynamics practitioners\n- Book recommendations on client acquisition",
      "uniqueMarker": "JAMES_INNOVATE_UNIQUE_MARKER_4H8B",
      "secretProject": "European market expansion",
      "themes": [
        "partnership dynamics",
        "client acquisition",
        "thought leadership"
      ]
    },
    {
      "clientId": "550e8400-e29b-41d4-a716-446655440008",
      "clientName": "James Wilson",
      "coachId": "550e8400-e29b-41d4-a716-446655440012",
      "coachName": "Jordan Taylor",
      "org": "Innovate Partners",
      "sessionDate": "2025-10-22T14:02:07.335Z",
      "sessionType": "breakthrough",
      "content": "Coaching Session: Breakthrough Moment\nClient: James Wilson, Managing Partner at Innovate Partners\nCoach: Jordan Taylor\nDate: 2025-10-22\nReference: JAMES_INNOVATE_UNIQUE_MARKER_4H8B\n\nJordan Taylor: James! I can tell from your energy that something significant has happened. What's going on?\n\nJames: Jordan, I had a breakthrough! Everything we've been working on around partnership dynamics finally clicked in yesterday's board meeting.\n\nJordan Taylor: Tell me everything. What made the difference?\n\nJames: Remember how we practiced reframing European market expansion as a strategic opportunity rather than a challenge? I used that exact framework.\n\nJordan Taylor: How did the board respond?\n\nJames: They were engaged in a way I haven't seen before. For the first time, they asked follow-up questions that showed they actually understood the vision.\n\nJordan Taylor: That's the power of thought leadership - when you communicate with confidence and clarity, people lean in. What else contributed to this success?\n\nJames: The preparation work we did on client acquisition. I anticipated their concerns and addressed them proactively.\n\nJordan Taylor: You've integrated multiple aspects of our work - partnership dynamics, client acquisition, thought leadership. This is what mastery looks like.\n\nJames: I feel like I've leveled up. The imposter syndrome that used to plague me before these meetings is significantly diminished.\n\nJordan Taylor: Let's anchor this win. What specific behaviors will you continue that led to this breakthrough?\n\nJames: Pre-meeting preparation with stakeholder mapping, practicing my key messages out loud, and arriving with an abundance mindset rather than defensiveness.\n\nJordan Taylor: Those are powerful practices. How can you apply them to European market expansion's next phase?\n\n[Discussion of applying breakthrough lessons to upcoming challenges]\n\nCelebration:\n- Board meeting success demonstrates growth in partnership dynamics and client acquisition and thought leadership\n- James Wilson has internalized coaching frameworks\n- Ready for increased challenge level in future sessions\n\nNext Steps:\n- Document the breakthrough process for future reference\n- Apply same preparation framework to European market expansion stakeholder presentations\n- Schedule debrief after next major Innovate Partners milestone",
      "uniqueMarker": "JAMES_INNOVATE_UNIQUE_MARKER_4H8B",
      "secretProject": "European market expansion",
      "themes": [
        "partnership dynamics",
        "client acquisition",
        "thought leadership"
      ]
    },
    {
      "clientId": "550e8400-e29b-41d4-a716-446655440002",
      "clientName": "Michael Torres",
      "coachId": "550e8400-e29b-41d4-a716-446655440011",
      "coachName": "Sam Chen",
      "org": "Acme Media",
      "sessionDate": "2025-07-18T16:55:21.286Z",
      "sessionType": "quarterly-review",
      "content": "Coaching Session: Quarterly Review\nClient: Michael Torres, Director of Engineering at Acme Media\nCoach: Sam Chen\nDate: 2025-07-18\nSession Marker: MICHAEL_ACME_UNIQUE_MARKER_6L2D\n\nSam Chen: Welcome back, Michael. I've been looking forward to our quarterly review. How are you feeling about the progress we've made?\n\nMichael: Thank you, Sam. It's been an intense quarter. VP promotion path - 18 month plan has consumed most of my bandwidth, but I feel like we're making real progress.\n\nSam Chen: Tell me more about VP promotion path - 18 month plan. What's working well?\n\nMichael: The team is finally aligned. We had some resistance initially, especially around career advancement, but after our last session where you helped me reframe the narrative, things clicked.\n\nSam Chen: I'm glad that career advancement framework is paying off. What challenges remain?\n\nMichael: Honestly, the biggest challenge is stakeholder management. As we scale, I'm finding it harder to maintain the quality of interactions with my team.\n\nSam Chen: Let's dig into that. When you say stakeholder management, what specifically concerns you?\n\nMichael: I used to have weekly 1:1s with everyone. Now with the growth, it's impossible. I'm worried about losing touch with the pulse of the organization.\n\nSam Chen: This is a common inflection point for leaders at your stage. Let me share a model that's helped other executives I've worked with...\n\n[Session continues with detailed discussion of leadership scaling strategies, action items, and next steps related to career advancement, stakeholder management, technical influence]\n\nAction Items:\n1. Implement skip-level meetings every two weeks\n2. Create a \"listening tour\" schedule for Q2\n3. Document VP promotion path - 18 month plan milestones for board presentation\n4. Practice technical influence exercises before next town hall\n\nNext session: Focus on technical influence development",
      "uniqueMarker": "MICHAEL_ACME_UNIQUE_MARKER_6L2D",
      "secretProject": "VP promotion path - 18 month plan",
      "themes": [
        "career advancement",
        "stakeholder management",
        "technical influence"
      ]
    },
    {
      "clientId": "550e8400-e29b-41d4-a716-446655440002",
      "clientName": "Michael Torres",
      "coachId": "550e8400-e29b-41d4-a716-446655440011",
      "coachName": "Sam Chen",
      "org": "Acme Media",
      "sessionDate": "2025-07-22T12:02:28.652Z",
      "sessionType": "challenge-session",
      "content": "Coaching Session: Challenge Deep-Dive\nClient: Michael Torres, Director of Engineering at Acme Media\nCoach: Sam Chen\nDate: 2025-07-22\nUnique Identifier: MICHAEL_ACME_UNIQUE_MARKER_6L2D\n\nSam Chen: Michael, you mentioned in your pre-session notes that you're facing a significant challenge with career advancement. Walk me through what's happening.\n\nMichael: Sam, I'm at a crossroads. VP promotion path - 18 month plan has hit a major roadblock. The board is asking tough questions, and I'm not sure I have the answers.\n\nSam Chen: Let's break this down. What exactly is the board concerned about?\n\nMichael: They want to see faster progress on stakeholder management. Our metrics aren't where we projected them to be.\n\nSam Chen: When you think about stakeholder management in the context of Acme Media's current stage, what does success actually look like?\n\nMichael: That's a good question. I think I've been measuring myself against industry benchmarks that don't apply to our unique situation.\n\nSam Chen: Exactly. Let's redefine success metrics that align with Acme Media's specific context. What would you say are the three most critical indicators?\n\nMichael: For VP promotion path - 18 month plan specifically, I'd say: customer retention, team velocity, and stakeholder confidence.\n\nSam Chen: Now we're getting somewhere. How do these connect to your work on technical influence?\n\nMichael: technical influence is the thread that ties it all together. If I can improve that, everything else follows.\n\nSam Chen: What's one action you could take this week that would move the needle on technical influence?\n\nMichael: I've been avoiding a difficult conversation with my leadership team about expectations. That needs to happen.\n\nSam Chen: Tell me about your hesitation around that conversation.\n\n[Detailed exploration of communication patterns, stakeholder management, and executive presence development]\n\nKey Insights:\n- Michael Torres recognizes the need for clearer metrics alignment\n- VP promotion path - 18 month plan requires reframing for stakeholder buy-in\n- technical influence is the critical development area for next quarter\n\nFollow-up: Schedule role-play session for difficult conversation practice",
      "uniqueMarker": "MICHAEL_ACME_UNIQUE_MARKER_6L2D",
      "secretProject": "VP promotion path - 18 month plan",
      "themes": [
        "career advancement",
        "stakeholder management",
        "technical influence"
      ]
    },
    {
      "clientId": "550e8400-e29b-41d4-a716-446655440002",
      "clientName": "Michael Torres",
      "coachId": "550e8400-e29b-41d4-a716-446655440011",
      "coachName": "Sam Chen",
      "org": "Acme Media",
      "sessionDate": "2025-07-27T11:56:32.780Z",
      "sessionType": "goal-setting",
      "content": "Coaching Session: Goal Alignment & Planning\nClient: Michael Torres, Director of Engineering at Acme Media\nCoach: Sam Chen\nDate: 2025-07-27\nSession ID: MICHAEL_ACME_UNIQUE_MARKER_6L2D\n\nSam Chen: Michael, as we enter this new planning cycle, I want to make sure our coaching goals are aligned with what matters most to you professionally and personally.\n\nMichael: Sam, that's perfect timing. Acme Media is going through major changes, and I need to recalibrate.\n\nSam Chen: What's driving that need for recalibration?\n\nMichael: VP promotion path - 18 month plan is entering its critical phase. My role is expanding, and I need to develop new capabilities, particularly in career advancement.\n\nSam Chen: Let's map out what career advancement looks like at the next level. Where do you feel most confident, and where do you see gaps?\n\nMichael: I'm confident in the tactical execution. Where I need growth is in stakeholder management - specifically, how to influence without direct authority.\n\nSam Chen: That's a sophisticated leadership challenge. At Acme Media, who are the key stakeholders you need to influence?\n\nMichael: The executive team, board members, and increasingly, external partners. It's a different game than what got me here.\n\nSam Chen: You're right - what got you here won't get you there. Let's design a development plan that addresses stakeholder management and technical influence.\n\nMichael: I appreciate that you understand the nuances of my situation. The complexity at Acme Media isn't always obvious to outsiders.\n\nSam Chen: That's why our work together goes beyond generic leadership advice. We're crafting a path that's specific to Michael Torres's journey at Acme Media.\n\n[Goal-setting framework discussion with SMART goals, accountability structures, and milestone planning]\n\nGoals Established:\n1. Master career advancement fundamentals by end of Q1\n2. Build stakeholder management influence map and engagement strategy\n3. Develop technical influence through deliberate practice\n4. VP promotion path - 18 month plan - achieve key milestone by month-end\n\nSupport Needed:\n- Weekly check-ins during critical VP promotion path - 18 month plan phases\n- Access to peer coaching cohort for career advancement practitioners\n- Book recommendations on stakeholder management",
      "uniqueMarker": "MICHAEL_ACME_UNIQUE_MARKER_6L2D",
      "secretProject": "VP promotion path - 18 month plan",
      "themes": [
        "career advancement",
        "stakeholder management",
        "technical influence"
      ]
    },
    {
      "clientId": "550e8400-e29b-41d4-a716-446655440002",
      "clientName": "Michael Torres",
      "coachId": "550e8400-e29b-41d4-a716-446655440011",
      "coachName": "Sam Chen",
      "org": "Acme Media",
      "sessionDate": "2025-09-10T11:44:02.352Z",
      "sessionType": "breakthrough",
      "content": "Coaching Session: Breakthrough Moment\nClient: Michael Torres, Director of Engineering at Acme Media\nCoach: Sam Chen\nDate: 2025-09-10\nReference: MICHAEL_ACME_UNIQUE_MARKER_6L2D\n\nSam Chen: Michael! I can tell from your energy that something significant has happened. What's going on?\n\nMichael: Sam, I had a breakthrough! Everything we've been working on around career advancement finally clicked in yesterday's board meeting.\n\nSam Chen: Tell me everything. What made the difference?\n\nMichael: Remember how we practiced reframing VP promotion path - 18 month plan as a strategic opportunity rather than a challenge? I used that exact framework.\n\nSam Chen: How did the board respond?\n\nMichael: They were engaged in a way I haven't seen before. For the first time, they asked follow-up questions that showed they actually understood the vision.\n\nSam Chen: That's the power of technical influence - when you communicate with confidence and clarity, people lean in. What else contributed to this success?\n\nMichael: The preparation work we did on stakeholder management. I anticipated their concerns and addressed them proactively.\n\nSam Chen: You've integrated multiple aspects of our work - career advancement, stakeholder management, technical influence. This is what mastery looks like.\n\nMichael: I feel like I've leveled up. The imposter syndrome that used to plague me before these meetings is significantly diminished.\n\nSam Chen: Let's anchor this win. What specific behaviors will you continue that led to this breakthrough?\n\nMichael: Pre-meeting preparation with stakeholder mapping, practicing my key messages out loud, and arriving with an abundance mindset rather than defensiveness.\n\nSam Chen: Those are powerful practices. How can you apply them to VP promotion path - 18 month plan's next phase?\n\n[Discussion of applying breakthrough lessons to upcoming challenges]\n\nCelebration:\n- Board meeting success demonstrates growth in career advancement and stakeholder management and technical influence\n- Michael Torres has internalized coaching frameworks\n- Ready for increased challenge level in future sessions\n\nNext Steps:\n- Document the breakthrough process for future reference\n- Apply same preparation framework to VP promotion path - 18 month plan stakeholder presentations\n- Schedule debrief after next major Acme Media milestone",
      "uniqueMarker": "MICHAEL_ACME_UNIQUE_MARKER_6L2D",
      "secretProject": "VP promotion path - 18 month plan",
      "themes": [
        "career advancement",
        "stakeholder management",
        "technical influence"
      ]
    },
    {
      "clientId": "550e8400-e29b-41d4-a716-446655440009",
      "clientName": "Amanda Foster",
      "coachId": "550e8400-e29b-41d4-a716-446655440011",
      "coachName": "Sam Chen",
      "org": "ScaleUp Ventures",
      "sessionDate": "2025-07-28T20:36:02.972Z",
      "sessionType": "quarterly-review",
      "content": "Coaching Session: Quarterly Review\nClient: Amanda Foster, COO at ScaleUp Ventures\nCoach: Sam Chen\nDate: 2025-07-28\nSession Marker: AMANDA_SCALEUP_UNIQUE_MARKER_1F7J\n\nSam Chen: Welcome back, Amanda. I've been looking forward to our quarterly review. How are you feeling about the progress we've made?\n\nAmanda: Thank you, Sam. It's been an intense quarter. SOC 2 compliance initiative has consumed most of my bandwidth, but I feel like we're making real progress.\n\nSam Chen: Tell me more about SOC 2 compliance initiative. What's working well?\n\nAmanda: The team is finally aligned. We had some resistance initially, especially around operational excellence, but after our last session where you helped me reframe the narrative, things clicked.\n\nSam Chen: I'm glad that operational excellence framework is paying off. What challenges remain?\n\nAmanda: Honestly, the biggest challenge is scaling processes. As we scale, I'm finding it harder to maintain the quality of interactions with my team.\n\nSam Chen: Let's dig into that. When you say scaling processes, what specifically concerns you?\n\nAmanda: I used to have weekly 1:1s with everyone. Now with the growth, it's impossible. I'm worried about losing touch with the pulse of the organization.\n\nSam Chen: This is a common inflection point for leaders at your stage. Let me share a model that's helped other executives I've worked with...\n\n[Session continues with detailed discussion of leadership scaling strategies, action items, and next steps related to operational excellence, scaling processes, CEO succession]\n\nAction Items:\n1. Implement skip-level meetings every two weeks\n2. Create a \"listening tour\" schedule for Q2\n3. Document SOC 2 compliance initiative milestones for board presentation\n4. Practice CEO succession exercises before next town hall\n\nNext session: Focus on CEO succession development",
      "uniqueMarker": "AMANDA_SCALEUP_UNIQUE_MARKER_1F7J",
      "secretProject": "SOC 2 compliance initiative",
      "themes": [
        "operational excellence",
        "scaling processes",
        "CEO succession"
      ]
    },
    {
      "clientId": "550e8400-e29b-41d4-a716-446655440009",
      "clientName": "Amanda Foster",
      "coachId": "550e8400-e29b-41d4-a716-446655440011",
      "coachName": "Sam Chen",
      "org": "ScaleUp Ventures",
      "sessionDate": "2025-08-25T20:17:07.039Z",
      "sessionType": "challenge-session",
      "content": "Coaching Session: Challenge Deep-Dive\nClient: Amanda Foster, COO at ScaleUp Ventures\nCoach: Sam Chen\nDate: 2025-08-25\nUnique Identifier: AMANDA_SCALEUP_UNIQUE_MARKER_1F7J\n\nSam Chen: Amanda, you mentioned in your pre-session notes that you're facing a significant challenge with operational excellence. Walk me through what's happening.\n\nAmanda: Sam, I'm at a crossroads. SOC 2 compliance initiative has hit a major roadblock. The board is asking tough questions, and I'm not sure I have the answers.\n\nSam Chen: Let's break this down. What exactly is the board concerned about?\n\nAmanda: They want to see faster progress on scaling processes. Our metrics aren't where we projected them to be.\n\nSam Chen: When you think about scaling processes in the context of ScaleUp Ventures's current stage, what does success actually look like?\n\nAmanda: That's a good question. I think I've been measuring myself against industry benchmarks that don't apply to our unique situation.\n\nSam Chen: Exactly. Let's redefine success metrics that align with ScaleUp Ventures's specific context. What would you say are the three most critical indicators?\n\nAmanda: For SOC 2 compliance initiative specifically, I'd say: customer retention, team velocity, and stakeholder confidence.\n\nSam Chen: Now we're getting somewhere. How do these connect to your work on CEO succession?\n\nAmanda: CEO succession is the thread that ties it all together. If I can improve that, everything else follows.\n\nSam Chen: What's one action you could take this week that would move the needle on CEO succession?\n\nAmanda: I've been avoiding a difficult conversation with my leadership team about expectations. That needs to happen.\n\nSam Chen: Tell me about your hesitation around that conversation.\n\n[Detailed exploration of communication patterns, stakeholder management, and executive presence development]\n\nKey Insights:\n- Amanda Foster recognizes the need for clearer metrics alignment\n- SOC 2 compliance initiative requires reframing for stakeholder buy-in\n- CEO succession is the critical development area for next quarter\n\nFollow-up: Schedule role-play session for difficult conversation practice",
      "uniqueMarker": "AMANDA_SCALEUP_UNIQUE_MARKER_1F7J",
      "secretProject": "SOC 2 compliance initiative",
      "themes": [
        "operational excellence",
        "scaling processes",
        "CEO succession"
      ]
    },
    {
      "clientId": "550e8400-e29b-41d4-a716-446655440009",
      "clientName": "Amanda Foster",
      "coachId": "550e8400-e29b-41d4-a716-446655440011",
      "coachName": "Sam Chen",
      "org": "ScaleUp Ventures",
      "sessionDate": "2025-09-14T08:34:20.692Z",
      "sessionType": "goal-setting",
      "content": "Coaching Session: Goal Alignment & Planning\nClient: Amanda Foster, COO at ScaleUp Ventures\nCoach: Sam Chen\nDate: 2025-09-14\nSession ID: AMANDA_SCALEUP_UNIQUE_MARKER_1F7J\n\nSam Chen: Amanda, as we enter this new planning cycle, I want to make sure our coaching goals are aligned with what matters most to you professionally and personally.\n\nAmanda: Sam, that's perfect timing. ScaleUp Ventures is going through major changes, and I need to recalibrate.\n\nSam Chen: What's driving that need for recalibration?\n\nAmanda: SOC 2 compliance initiative is entering its critical phase. My role is expanding, and I need to develop new capabilities, particularly in operational excellence.\n\nSam Chen: Let's map out what operational excellence looks like at the next level. Where do you feel most confident, and where do you see gaps?\n\nAmanda: I'm confident in the tactical execution. Where I need growth is in scaling processes - specifically, how to influence without direct authority.\n\nSam Chen: That's a sophisticated leadership challenge. At ScaleUp Ventures, who are the key stakeholders you need to influence?\n\nAmanda: The executive team, board members, and increasingly, external partners. It's a different game than what got me here.\n\nSam Chen: You're right - what got you here won't get you there. Let's design a development plan that addresses scaling processes and CEO succession.\n\nAmanda: I appreciate that you understand the nuances of my situation. The complexity at ScaleUp Ventures isn't always obvious to outsiders.\n\nSam Chen: That's why our work together goes beyond generic leadership advice. We're crafting a path that's specific to Amanda Foster's journey at ScaleUp Ventures.\n\n[Goal-setting framework discussion with SMART goals, accountability structures, and milestone planning]\n\nGoals Established:\n1. Master operational excellence fundamentals by end of Q1\n2. Build scaling processes influence map and engagement strategy\n3. Develop CEO succession through deliberate practice\n4. SOC 2 compliance initiative - achieve key milestone by month-end\n\nSupport Needed:\n- Weekly check-ins during critical SOC 2 compliance initiative phases\n- Access to peer coaching cohort for operational excellence practitioners\n- Book recommendations on scaling processes",
      "uniqueMarker": "AMANDA_SCALEUP_UNIQUE_MARKER_1F7J",
      "secretProject": "SOC 2 compliance initiative",
      "themes": [
        "operational excellence",
        "scaling processes",
        "CEO succession"
      ]
    },
    {
      "clientId": "550e8400-e29b-41d4-a716-446655440009",
      "clientName": "Amanda Foster",
      "coachId": "550e8400-e29b-41d4-a716-446655440011",
      "coachName": "Sam Chen",
      "org": "ScaleUp Ventures",
      "sessionDate": "2025-10-26T12:31:07.066Z",
      "sessionType": "breakthrough",
      "content": "Coaching Session: Breakthrough Moment\nClient: Amanda Foster, COO at ScaleUp Ventures\nCoach: Sam Chen\nDate: 2025-10-26\nReference: AMANDA_SCALEUP_UNIQUE_MARKER_1F7J\n\nSam Chen: Amanda! I can tell from your energy that something significant has happened. What's going on?\n\nAmanda: Sam, I had a breakthrough! Everything we've been working on around operational excellence finally clicked in yesterday's board meeting.\n\nSam Chen: Tell me everything. What made the difference?\n\nAmanda: Remember how we practiced reframing SOC 2 compliance initiative as a strategic opportunity rather than a challenge? I used that exact framework.\n\nSam Chen: How did the board respond?\n\nAmanda: They were engaged in a way I haven't seen before. For the first time, they asked follow-up questions that showed they actually understood the vision.\n\nSam Chen: That's the power of CEO succession - when you communicate with confidence and clarity, people lean in. What else contributed to this success?\n\nAmanda: The preparation work we did on scaling processes. I anticipated their concerns and addressed them proactively.\n\nSam Chen: You've integrated multiple aspects of our work - operational excellence, scaling processes, CEO succession. This is what mastery looks like.\n\nAmanda: I feel like I've leveled up. The imposter syndrome that used to plague me before these meetings is significantly diminished.\n\nSam Chen: Let's anchor this win. What specific behaviors will you continue that led to this breakthrough?\n\nAmanda: Pre-meeting preparation with stakeholder mapping, practicing my key messages out loud, and arriving with an abundance mindset rather than defensiveness.\n\nSam Chen: Those are powerful practices. How can you apply them to SOC 2 compliance initiative's next phase?\n\n[Discussion of applying breakthrough lessons to upcoming challenges]\n\nCelebration:\n- Board meeting success demonstrates growth in operational excellence and scaling processes and CEO succession\n- Amanda Foster has internalized coaching frameworks\n- Ready for increased challenge level in future sessions\n\nNext Steps:\n- Document the breakthrough process for future reference\n- Apply same preparation framework to SOC 2 compliance initiative stakeholder presentations\n- Schedule debrief after next major ScaleUp Ventures milestone",
      "uniqueMarker": "AMANDA_SCALEUP_UNIQUE_MARKER_1F7J",
      "secretProject": "SOC 2 compliance initiative",
      "themes": [
        "operational excellence",
        "scaling processes",
        "CEO succession"
      ]
    },
    {
      "clientId": "550e8400-e29b-41d4-a716-44665544000a",
      "clientName": "Kevin Chen",
      "coachId": "550e8400-e29b-41d4-a716-446655440011",
      "coachName": "Sam Chen",
      "org": "Innovate Partners",
      "sessionDate": "2025-07-24T11:50:59.152Z",
      "sessionType": "quarterly-review",
      "content": "Coaching Session: Quarterly Review\nClient: Kevin Chen, Director of Strategy at Innovate Partners\nCoach: Sam Chen\nDate: 2025-07-24\nSession Marker: KEVIN_INNOVATE_UNIQUE_MARKER_0G5K\n\nSam Chen: Welcome back, Kevin. I've been looking forward to our quarterly review. How are you feeling about the progress we've made?\n\nKevin: Thank you, Sam. It's been an intense quarter. Acquisition target analysis has consumed most of my bandwidth, but I feel like we're making real progress.\n\nSam Chen: Tell me more about Acquisition target analysis. What's working well?\n\nKevin: The team is finally aligned. We had some resistance initially, especially around strategic planning, but after our last session where you helped me reframe the narrative, things clicked.\n\nSam Chen: I'm glad that strategic planning framework is paying off. What challenges remain?\n\nKevin: Honestly, the biggest challenge is cross-functional leadership. As we scale, I'm finding it harder to maintain the quality of interactions with my team.\n\nSam Chen: Let's dig into that. When you say cross-functional leadership, what specifically concerns you?\n\nKevin: I used to have weekly 1:1s with everyone. Now with the growth, it's impossible. I'm worried about losing touch with the pulse of the organization.\n\nSam Chen: This is a common inflection point for leaders at your stage. Let me share a model that's helped other executives I've worked with...\n\n[Session continues with detailed discussion of leadership scaling strategies, action items, and next steps related to strategic planning, cross-functional leadership, M&A integration]\n\nAction Items:\n1. Implement skip-level meetings every two weeks\n2. Create a \"listening tour\" schedule for Q2\n3. Document Acquisition target analysis milestones for board presentation\n4. Practice M&A integration exercises before next town hall\n\nNext session: Focus on M&A integration development",
      "uniqueMarker": "KEVIN_INNOVATE_UNIQUE_MARKER_0G5K",
      "secretProject": "Acquisition target analysis",
      "themes": [
        "strategic planning",
        "cross-functional leadership",
        "M&A integration"
      ]
    },
    {
      "clientId": "550e8400-e29b-41d4-a716-44665544000a",
      "clientName": "Kevin Chen",
      "coachId": "550e8400-e29b-41d4-a716-446655440011",
      "coachName": "Sam Chen",
      "org": "Innovate Partners",
      "sessionDate": "2025-08-03T21:19:28.929Z",
      "sessionType": "challenge-session",
      "content": "Coaching Session: Challenge Deep-Dive\nClient: Kevin Chen, Director of Strategy at Innovate Partners\nCoach: Sam Chen\nDate: 2025-08-03\nUnique Identifier: KEVIN_INNOVATE_UNIQUE_MARKER_0G5K\n\nSam Chen: Kevin, you mentioned in your pre-session notes that you're facing a significant challenge with strategic planning. Walk me through what's happening.\n\nKevin: Sam, I'm at a crossroads. Acquisition target analysis has hit a major roadblock. The board is asking tough questions, and I'm not sure I have the answers.\n\nSam Chen: Let's break this down. What exactly is the board concerned about?\n\nKevin: They want to see faster progress on cross-functional leadership. Our metrics aren't where we projected them to be.\n\nSam Chen: When you think about cross-functional leadership in the context of Innovate Partners's current stage, what does success actually look like?\n\nKevin: That's a good question. I think I've been measuring myself against industry benchmarks that don't apply to our unique situation.\n\nSam Chen: Exactly. Let's redefine success metrics that align with Innovate Partners's specific context. What would you say are the three most critical indicators?\n\nKevin: For Acquisition target analysis specifically, I'd say: customer retention, team velocity, and stakeholder confidence.\n\nSam Chen: Now we're getting somewhere. How do these connect to your work on M&A integration?\n\nKevin: M&A integration is the thread that ties it all together. If I can improve that, everything else follows.\n\nSam Chen: What's one action you could take this week that would move the needle on M&A integration?\n\nKevin: I've been avoiding a difficult conversation with my leadership team about expectations. That needs to happen.\n\nSam Chen: Tell me about your hesitation around that conversation.\n\n[Detailed exploration of communication patterns, stakeholder management, and executive presence development]\n\nKey Insights:\n- Kevin Chen recognizes the need for clearer metrics alignment\n- Acquisition target analysis requires reframing for stakeholder buy-in\n- M&A integration is the critical development area for next quarter\n\nFollow-up: Schedule role-play session for difficult conversation practice",
      "uniqueMarker": "KEVIN_INNOVATE_UNIQUE_MARKER_0G5K",
      "secretProject": "Acquisition target analysis",
      "themes": [
        "strategic planning",
        "cross-functional leadership",
        "M&A integration"
      ]
    },
    {
      "clientId": "550e8400-e29b-41d4-a716-44665544000a",
      "clientName": "Kevin Chen",
      "coachId": "550e8400-e29b-41d4-a716-446655440011",
      "coachName": "Sam Chen",
      "org": "Innovate Partners",
      "sessionDate": "2025-08-13T14:30:43.707Z",
      "sessionType": "goal-setting",
      "content": "Coaching Session: Goal Alignment & Planning\nClient: Kevin Chen, Director of Strategy at Innovate Partners\nCoach: Sam Chen\nDate: 2025-08-13\nSession ID: KEVIN_INNOVATE_UNIQUE_MARKER_0G5K\n\nSam Chen: Kevin, as we enter this new planning cycle, I want to make sure our coaching goals are aligned with what matters most to you professionally and personally.\n\nKevin: Sam, that's perfect timing. Innovate Partners is going through major changes, and I need to recalibrate.\n\nSam Chen: What's driving that need for recalibration?\n\nKevin: Acquisition target analysis is entering its critical phase. My role is expanding, and I need to develop new capabilities, particularly in strategic planning.\n\nSam Chen: Let's map out what strategic planning looks like at the next level. Where do you feel most confident, and where do you see gaps?\n\nKevin: I'm confident in the tactical execution. Where I need growth is in cross-functional leadership - specifically, how to influence without direct authority.\n\nSam Chen: That's a sophisticated leadership challenge. At Innovate Partners, who are the key stakeholders you need to influence?\n\nKevin: The executive team, board members, and increasingly, external partners. It's a different game than what got me here.\n\nSam Chen: You're right - what got you here won't get you there. Let's design a development plan that addresses cross-functional leadership and M&A integration.\n\nKevin: I appreciate that you understand the nuances of my situation. The complexity at Innovate Partners isn't always obvious to outsiders.\n\nSam Chen: That's why our work together goes beyond generic leadership advice. We're crafting a path that's specific to Kevin Chen's journey at Innovate Partners.\n\n[Goal-setting framework discussion with SMART goals, accountability structures, and milestone planning]\n\nGoals Established:\n1. Master strategic planning fundamentals by end of Q1\n2. Build cross-functional leadership influence map and engagement strategy\n3. Develop M&A integration through deliberate practice\n4. Acquisition target analysis - achieve key milestone by month-end\n\nSupport Needed:\n- Weekly check-ins during critical Acquisition target analysis phases\n- Access to peer coaching cohort for strategic planning practitioners\n- Book recommendations on cross-functional leadership",
      "uniqueMarker": "KEVIN_INNOVATE_UNIQUE_MARKER_0G5K",
      "secretProject": "Acquisition target analysis",
      "themes": [
        "strategic planning",
        "cross-functional leadership",
        "M&A integration"
      ]
    },
    {
      "clientId": "550e8400-e29b-41d4-a716-44665544000a",
      "clientName": "Kevin Chen",
      "coachId": "550e8400-e29b-41d4-a716-446655440011",
      "coachName": "Sam Chen",
      "org": "Innovate Partners",
      "sessionDate": "2025-11-17T16:56:26.567Z",
      "sessionType": "breakthrough",
      "content": "Coaching Session: Breakthrough Moment\nClient: Kevin Chen, Director of Strategy at Innovate Partners\nCoach: Sam Chen\nDate: 2025-11-17\nReference: KEVIN_INNOVATE_UNIQUE_MARKER_0G5K\n\nSam Chen: Kevin! I can tell from your energy that something significant has happened. What's going on?\n\nKevin: Sam, I had a breakthrough! Everything we've been working on around strategic planning finally clicked in yesterday's board meeting.\n\nSam Chen: Tell me everything. What made the difference?\n\nKevin: Remember how we practiced reframing Acquisition target analysis as a strategic opportunity rather than a challenge? I used that exact framework.\n\nSam Chen: How did the board respond?\n\nKevin: They were engaged in a way I haven't seen before. For the first time, they asked follow-up questions that showed they actually understood the vision.\n\nSam Chen: That's the power of M&A integration - when you communicate with confidence and clarity, people lean in. What else contributed to this success?\n\nKevin: The preparation work we did on cross-functional leadership. I anticipated their concerns and addressed them proactively.\n\nSam Chen: You've integrated multiple aspects of our work - strategic planning, cross-functional leadership, M&A integration. This is what mastery looks like.\n\nKevin: I feel like I've leveled up. The imposter syndrome that used to plague me before these meetings is significantly diminished.\n\nSam Chen: Let's anchor this win. What specific behaviors will you continue that led to this breakthrough?\n\nKevin: Pre-meeting preparation with stakeholder mapping, practicing my key messages out loud, and arriving with an abundance mindset rather than defensiveness.\n\nSam Chen: Those are powerful practices. How can you apply them to Acquisition target analysis's next phase?\n\n[Discussion of applying breakthrough lessons to upcoming challenges]\n\nCelebration:\n- Board meeting success demonstrates growth in strategic planning and cross-functional leadership and M&A integration\n- Kevin Chen has internalized coaching frameworks\n- Ready for increased challenge level in future sessions\n\nNext Steps:\n- Document the breakthrough process for future reference\n- Apply same preparation framework to Acquisition target analysis stakeholder presentations\n- Schedule debrief after next major Innovate Partners milestone",
      "uniqueMarker": "KEVIN_INNOVATE_UNIQUE_MARKER_0G5K",
      "secretProject": "Acquisition target analysis",
      "themes": [
        "strategic planning",
        "cross-functional leadership",
        "M&A integration"
      ]
    },
    {
      "clientId": "550e8400-e29b-41d4-a716-44665544000b",
      "clientName": "Rachel Adams",
      "coachId": "550e8400-e29b-41d4-a716-446655440011",
      "coachName": "Sam Chen",
      "org": "GrowthLabs",
      "sessionDate": "2025-07-17T23:30:27.211Z",
      "sessionType": "quarterly-review",
      "content": "Coaching Session: Quarterly Review\nClient: Rachel Adams, Head of Product at GrowthLabs\nCoach: Sam Chen\nDate: 2025-07-17\nSession Marker: RACHEL_GROWTHLABS_UNIQUE_MARKER_3C9M\n\nSam Chen: Welcome back, Rachel. I've been looking forward to our quarterly review. How are you feeling about the progress we've made?\n\nRachel: Thank you, Sam. It's been an intense quarter. Enterprise pivot strategy has consumed most of my bandwidth, but I feel like we're making real progress.\n\nSam Chen: Tell me more about Enterprise pivot strategy. What's working well?\n\nRachel: The team is finally aligned. We had some resistance initially, especially around product-market fit, but after our last session where you helped me reframe the narrative, things clicked.\n\nSam Chen: I'm glad that product-market fit framework is paying off. What challenges remain?\n\nRachel: Honestly, the biggest challenge is user research. As we scale, I'm finding it harder to maintain the quality of interactions with my team.\n\nSam Chen: Let's dig into that. When you say user research, what specifically concerns you?\n\nRachel: I used to have weekly 1:1s with everyone. Now with the growth, it's impossible. I'm worried about losing touch with the pulse of the organization.\n\nSam Chen: This is a common inflection point for leaders at your stage. Let me share a model that's helped other executives I've worked with...\n\n[Session continues with detailed discussion of leadership scaling strategies, action items, and next steps related to product-market fit, user research, roadmap prioritization]\n\nAction Items:\n1. Implement skip-level meetings every two weeks\n2. Create a \"listening tour\" schedule for Q2\n3. Document Enterprise pivot strategy milestones for board presentation\n4. Practice roadmap prioritization exercises before next town hall\n\nNext session: Focus on roadmap prioritization development",
      "uniqueMarker": "RACHEL_GROWTHLABS_UNIQUE_MARKER_3C9M",
      "secretProject": "Enterprise pivot strategy",
      "themes": [
        "product-market fit",
        "user research",
        "roadmap prioritization"
      ]
    },
    {
      "clientId": "550e8400-e29b-41d4-a716-44665544000b",
      "clientName": "Rachel Adams",
      "coachId": "550e8400-e29b-41d4-a716-446655440011",
      "coachName": "Sam Chen",
      "org": "GrowthLabs",
      "sessionDate": "2025-07-19T01:15:38.704Z",
      "sessionType": "challenge-session",
      "content": "Coaching Session: Challenge Deep-Dive\nClient: Rachel Adams, Head of Product at GrowthLabs\nCoach: Sam Chen\nDate: 2025-07-19\nUnique Identifier: RACHEL_GROWTHLABS_UNIQUE_MARKER_3C9M\n\nSam Chen: Rachel, you mentioned in your pre-session notes that you're facing a significant challenge with product-market fit. Walk me through what's happening.\n\nRachel: Sam, I'm at a crossroads. Enterprise pivot strategy has hit a major roadblock. The board is asking tough questions, and I'm not sure I have the answers.\n\nSam Chen: Let's break this down. What exactly is the board concerned about?\n\nRachel: They want to see faster progress on user research. Our metrics aren't where we projected them to be.\n\nSam Chen: When you think about user research in the context of GrowthLabs's current stage, what does success actually look like?\n\nRachel: That's a good question. I think I've been measuring myself against industry benchmarks that don't apply to our unique situation.\n\nSam Chen: Exactly. Let's redefine success metrics that align with GrowthLabs's specific context. What would you say are the three most critical indicators?\n\nRachel: For Enterprise pivot strategy specifically, I'd say: customer retention, team velocity, and stakeholder confidence.\n\nSam Chen: Now we're getting somewhere. How do these connect to your work on roadmap prioritization?\n\nRachel: roadmap prioritization is the thread that ties it all together. If I can improve that, everything else follows.\n\nSam Chen: What's one action you could take this week that would move the needle on roadmap prioritization?\n\nRachel: I've been avoiding a difficult conversation with my leadership team about expectations. That needs to happen.\n\nSam Chen: Tell me about your hesitation around that conversation.\n\n[Detailed exploration of communication patterns, stakeholder management, and executive presence development]\n\nKey Insights:\n- Rachel Adams recognizes the need for clearer metrics alignment\n- Enterprise pivot strategy requires reframing for stakeholder buy-in\n- roadmap prioritization is the critical development area for next quarter\n\nFollow-up: Schedule role-play session for difficult conversation practice",
      "uniqueMarker": "RACHEL_GROWTHLABS_UNIQUE_MARKER_3C9M",
      "secretProject": "Enterprise pivot strategy",
      "themes": [
        "product-market fit",
        "user research",
        "roadmap prioritization"
      ]
    },
    {
      "clientId": "550e8400-e29b-41d4-a716-44665544000b",
      "clientName": "Rachel Adams",
      "coachId": "550e8400-e29b-41d4-a716-446655440011",
      "coachName": "Sam Chen",
      "org": "GrowthLabs",
      "sessionDate": "2025-09-12T06:46:46.555Z",
      "sessionType": "goal-setting",
      "content": "Coaching Session: Goal Alignment & Planning\nClient: Rachel Adams, Head of Product at GrowthLabs\nCoach: Sam Chen\nDate: 2025-09-12\nSession ID: RACHEL_GROWTHLABS_UNIQUE_MARKER_3C9M\n\nSam Chen: Rachel, as we enter this new planning cycle, I want to make sure our coaching goals are aligned with what matters most to you professionally and personally.\n\nRachel: Sam, that's perfect timing. GrowthLabs is going through major changes, and I need to recalibrate.\n\nSam Chen: What's driving that need for recalibration?\n\nRachel: Enterprise pivot strategy is entering its critical phase. My role is expanding, and I need to develop new capabilities, particularly in product-market fit.\n\nSam Chen: Let's map out what product-market fit looks like at the next level. Where do you feel most confident, and where do you see gaps?\n\nRachel: I'm confident in the tactical execution. Where I need growth is in user research - specifically, how to influence without direct authority.\n\nSam Chen: That's a sophisticated leadership challenge. At GrowthLabs, who are the key stakeholders you need to influence?\n\nRachel: The executive team, board members, and increasingly, external partners. It's a different game than what got me here.\n\nSam Chen: You're right - what got you here won't get you there. Let's design a development plan that addresses user research and roadmap prioritization.\n\nRachel: I appreciate that you understand the nuances of my situation. The complexity at GrowthLabs isn't always obvious to outsiders.\n\nSam Chen: That's why our work together goes beyond generic leadership advice. We're crafting a path that's specific to Rachel Adams's journey at GrowthLabs.\n\n[Goal-setting framework discussion with SMART goals, accountability structures, and milestone planning]\n\nGoals Established:\n1. Master product-market fit fundamentals by end of Q1\n2. Build user research influence map and engagement strategy\n3. Develop roadmap prioritization through deliberate practice\n4. Enterprise pivot strategy - achieve key milestone by month-end\n\nSupport Needed:\n- Weekly check-ins during critical Enterprise pivot strategy phases\n- Access to peer coaching cohort for product-market fit practitioners\n- Book recommendations on user research",
      "uniqueMarker": "RACHEL_GROWTHLABS_UNIQUE_MARKER_3C9M",
      "secretProject": "Enterprise pivot strategy",
      "themes": [
        "product-market fit",
        "user research",
        "roadmap prioritization"
      ]
    },
    {
      "clientId": "550e8400-e29b-41d4-a716-44665544000b",
      "clientName": "Rachel Adams",
      "coachId": "550e8400-e29b-41d4-a716-446655440011",
      "coachName": "Sam Chen",
      "org": "GrowthLabs",
      "sessionDate": "2025-11-21T02:56:48.931Z",
      "sessionType": "breakthrough",
      "content": "Coaching Session: Breakthrough Moment\nClient: Rachel Adams, Head of Product at GrowthLabs\nCoach: Sam Chen\nDate: 2025-11-21\nReference: RACHEL_GROWTHLABS_UNIQUE_MARKER_3C9M\n\nSam Chen: Rachel! I can tell from your energy that something significant has happened. What's going on?\n\nRachel: Sam, I had a breakthrough! Everything we've been working on around product-market fit finally clicked in yesterday's board meeting.\n\nSam Chen: Tell me everything. What made the difference?\n\nRachel: Remember how we practiced reframing Enterprise pivot strategy as a strategic opportunity rather than a challenge? I used that exact framework.\n\nSam Chen: How did the board respond?\n\nRachel: They were engaged in a way I haven't seen before. For the first time, they asked follow-up questions that showed they actually understood the vision.\n\nSam Chen: That's the power of roadmap prioritization - when you communicate with confidence and clarity, people lean in. What else contributed to this success?\n\nRachel: The preparation work we did on user research. I anticipated their concerns and addressed them proactively.\n\nSam Chen: You've integrated multiple aspects of our work - product-market fit, user research, roadmap prioritization. This is what mastery looks like.\n\nRachel: I feel like I've leveled up. The imposter syndrome that used to plague me before these meetings is significantly diminished.\n\nSam Chen: Let's anchor this win. What specific behaviors will you continue that led to this breakthrough?\n\nRachel: Pre-meeting preparation with stakeholder mapping, practicing my key messages out loud, and arriving with an abundance mindset rather than defensiveness.\n\nSam Chen: Those are powerful practices. How can you apply them to Enterprise pivot strategy's next phase?\n\n[Discussion of applying breakthrough lessons to upcoming challenges]\n\nCelebration:\n- Board meeting success demonstrates growth in product-market fit and user research and roadmap prioritization\n- Rachel Adams has internalized coaching frameworks\n- Ready for increased challenge level in future sessions\n\nNext Steps:\n- Document the breakthrough process for future reference\n- Apply same preparation framework to Enterprise pivot strategy stakeholder presentations\n- Schedule debrief after next major GrowthLabs milestone",
      "uniqueMarker": "RACHEL_GROWTHLABS_UNIQUE_MARKER_3C9M",
      "secretProject": "Enterprise pivot strategy",
      "themes": [
        "product-market fit",
        "user research",
        "roadmap prioritization"
      ]
    }
  ]
}
